MEMNAME,MEMLABEL,NAME,TYPE,LENGTH,VARNUM,LABEL,FORMAT,FORMATL,INFORMAT
BACH2PUBLICUSE,,EMPTYFRQ,1,8,977,FOIG: K1ai. A sensation of not emptying bladder completely?,X2330F_II,0,
BACH2PUBLICUSE,,EMPTYFRQ_1,1,8,1367,FOFD: J1ai. Would you say: sensation bladder not empty,X2406F_II,0,
BACH2PUBLICUSE,,EMPTYHEP_1,1,8,1370,FOFD: J1aiv. Seen a provider for this symptom: bladder not empty,X2506F_II,0,
BACH2PUBLICUSE,,EMPTYTRT_1,1,8,1371,FOFD: J1av. IF YES: Did you receive treatment: bladder not empty,X2465F_II,0,
BACH2PUBLICUSE,,ENDBIOAGE_1,1,8,464,FOFC: G5hi. How old were you at the time of surgery:Age,X2311F_II,0,
BACH2PUBLICUSE,,ENDBIONUM_1,1,8,465,FOFC: G5h1. If Yes: How many,X2311F_II,0,
BACH2PUBLICUSE,,ENDBIO_1,1,8,1707,FOFC: G5h. Have you ever had: An Endometrical Biopsy,X2497F_II,0,
BACH2PUBLICUSE,,ENDOAGE,1,8,133,FOID: E3hhii. How old were you when you were first told,X2311F_II,0,
BACH2PUBLICUSE,,ENDOMET,1,8,1642,FOID: E3hh. Endometriosis,X2511F_II,0,
BACH2PUBLICUSE,,ENDOMETAGE_1,1,8,381,FOFB: E1ssi. Ever told you had: Endometriosis: Age,X2311F_II,0,
BACH2PUBLICUSE,,ENDOMET_1,1,8,1685,FOFB: E1ss. Ever told you had: Endometriosis,X2506F_II,0,
BACH2PUBLICUSE,,ENDOTX,1,8,132,FOID: E3hhi. Have you ever or are you currently receiving treatment,X2501F_II,0,
BACH2PUBLICUSE,,ENDTIMEI_1,2,5,519,FOFE: M8. End time of interview,,0,$
BACH2PUBLICUSE,,ENDTM00,2,5,277,FOPM: B6. End time,,0,$
BACH2PUBLICUSE,,ENG3SACNOP_1,1,8,799,MSAQ/WSAQ: Past 3 months: engaged in sexual activity with no partner (Batch 2-5),X2506F_II,0,
BACH2PUBLICUSE,,ENG3SACP_1,1,8,695,MSAQ/WSAQ: Past 3 months: engaged in sexual activity with a partner,X2506F_II,0,
BACH2PUBLICUSE,,ENG4SACNOP_1,1,8,1601,MSAQ/WSAQ: Past 4 weeks: engaged in sexual activity with no partner (Batch 2-5),X2506F_II,0,
BACH2PUBLICUSE,,ENG4SACP,1,8,1074,FOSM: PM3. Have you engaged in sexual activities with your partner,X2506F_II,0,
BACH2PUBLICUSE,,ENG4SACP_1,1,8,1560,MSAQ/WSAQ: Past 4 weeks: engaged in sexual activity with a partner,X2506F_II,0,
BACH2PUBLICUSE,,ENUFSLP,1,8,1029,FOIG: K5d. Getting enough sleep at night?,X2336F_II,0,
BACH2PUBLICUSE,,ENUFSLP_1,1,8,1497,FOFD: J5d. Getting enough sleep at night,X2444F_II,0,
BACH2PUBLICUSE,,ETIMSAQ,2,5,267,FOIJ: P3. End time of SAQ:,,0,$
BACH2PUBLICUSE,,EVERPREG_1,1,8,497,FOFC: G6. Have you ever been pregnant? (not imputed or cleaned),X2506F_II,0,
BACH2PUBLICUSE,,EVRETOH,1,8,959,FOIF: J8. Have you ever had an alcoholic drink?,X2506F_II,0,
BACH2PUBLICUSE,,EVRETOH_1,1,8,1339,FOFC: I8. Have you ever had an alcoholic drink,X2506F_II,0,
BACH2PUBLICUSE,,FACE_M,1,8,548,PAIN: C2b. Face: most pain,X2505F_II,0,
BACH2PUBLICUSE,,FACE_S,1,8,547,PAIN: C2a. Face: shaded pain,X2505F_II,0,
BACH2PUBLICUSE,,FANKLFT_M,1,8,600,PAIN: C28b. Front Ankle Left: most pain,X2505F_II,0,
BACH2PUBLICUSE,,FANKLFT_S,1,8,599,PAIN: C28a. Front Ankle Left: shaded pain,X2505F_II,0,
BACH2PUBLICUSE,,FANKRT_M,1,8,598,PAIN: C27b. Front Ankle Right: most pain,X2505F_II,0,
BACH2PUBLICUSE,,FANKRT_S,1,8,597,PAIN: C27a. Front Ankle Right: shaded pain,X2505F_II,0,
BACH2PUBLICUSE,,FARMLFT_M,1,8,558,PAIN: C7b. Front Arm Left: most pain,X2505F_II,0,
BACH2PUBLICUSE,,FARMLFT_S,1,8,557,PAIN: C7a. Front Arm Left: shaded pain,X2505F_II,0,
BACH2PUBLICUSE,,FARMRT_M,1,8,556,PAIN: C6b. Front Arm Right: most pain,X2505F_II,0,
BACH2PUBLICUSE,,FARMRT_S,1,8,555,PAIN: C6a. Front Arm Right: shaded pain,X2505F_II,0,
BACH2PUBLICUSE,,FATIGUE1_1,1,8,317,FOFA. B8a. How weak did you feel? (Batch 1),FAT1F,0,
BACH2PUBLICUSE,,FATIGUE2_1,1,8,318,FOFA. B8b. How sleepy did you feel? (Batch 1),FAT2F,0,
BACH2PUBLICUSE,,FATIGUE3_1,1,8,316,FOFA. B8c. How lively did you feel? (Batch 1),FAT3F,0,
BACH2PUBLICUSE,,FATIGUE4_1,1,8,319,FOFA. B8d. How tired did you feel? (Batch 1),FAT4F,0,
BACH2PUBLICUSE,,FATIGUE5_1,1,8,320,FOFA. B8e. What was your usual energy level? (Batch 1),FAT5F,0,
BACH2PUBLICUSE,,FEARADPE_1,1,8,733,"MSAQ/WSAQ: During adulthood, afraid you might be injured? (Batch 1)",X2506F_II,0,
BACH2PUBLICUSE,,FEARADSX_1,1,8,704,"MSAQ/WSAQ: During adulthood, when this happened were you afraid that you might be injured (Batch 1)",X2506F_II,0,
BACH2PUBLICUSE,,FEARCHDPE_1,1,8,728,MSAQ/WSAQ: During childhood afraid you might be injured? (Batch 1),X2506F_II,0,
BACH2PUBLICUSE,,FEARCHSX_1,1,8,699,"MSAQ/WSAQ: During childhood, when this happened were you afraid that you might be injured (Batch 1)",X2506F_II,0,
BACH2PUBLICUSE,,FELBLFT_M,1,8,562,PAIN: C9b. Front Elbow Left: most pain,X2505F_II,0,
BACH2PUBLICUSE,,FELBLFT_S,1,8,561,PAIN: C9a. Front Elbow Left: shaded pain,X2505F_II,0,
BACH2PUBLICUSE,,FELBRT_M,1,8,560,PAIN: C8b. Front Elbow Right: most pain,X2505F_II,0,
BACH2PUBLICUSE,,FELBRT_S,1,8,559,PAIN: C8a. Front Elbow Right: shaded pain,X2505F_II,0,
BACH2PUBLICUSE,,FEMHORM,1,8,32,FOIB: C2r. Any female hormones other than for birth control,X2506F_II,0,
BACH2PUBLICUSE,,FEMHORM_1,1,8,681,FOFA: D2q. Any female hormones,X2506F_II,0,
BACH2PUBLICUSE,,FFARMLFT_M,1,8,566,PAIN: C11b. Front Forearm Left: most pain,X2505F_II,0,
BACH2PUBLICUSE,,FFARMLFT_S,1,8,565,PAIN: C11a. Front Forearm Left: shaded pain,X2505F_II,0,
BACH2PUBLICUSE,,FFARMRT_M,1,8,564,PAIN: C10b. Front Forearm Right: most pain,X2505F_II,0,
BACH2PUBLICUSE,,FFARMRT_S,1,8,563,PAIN: C10a. Front Forearm Right: shaded pain,X2505F_II,0,
BACH2PUBLICUSE,,FFOOTLFT_M,1,8,604,PAIN: C30b. Front Foot Left: most pain,X2505F_II,0,
BACH2PUBLICUSE,,FFOOTLFT_S,1,8,603,PAIN: C30a. Front Foot Left: shaded pain,X2505F_II,0,
BACH2PUBLICUSE,,FFOOTRT_M,1,8,602,PAIN: C29b. Front Foot Right: most pain,X2505F_II,0,
BACH2PUBLICUSE,,FFOOTRT_S,1,8,601,PAIN: C29a. Front Foot Right: shaded pain,X2505F_II,0,
BACH2PUBLICUSE,,FHNDLFT_M,1,8,574,PAIN: C15b. Front Hand Left: most pain,X2505F_II,0,
BACH2PUBLICUSE,,FHNDLFT_S,1,8,573,PAIN: C15a. Front Hand Left: shaded pain,X2505F_II,0,
BACH2PUBLICUSE,,FHNDRT_M,1,8,572,PAIN: C14b. Front Hand Right: most pain,X2505F_II,0,
BACH2PUBLICUSE,,FHNDRT_S,1,8,571,PAIN: C14a. Front Hand Right: shaded pain,X2505F_II,0,
BACH2PUBLICUSE,,FIBRAGE,1,8,141,FOID: E3llii. How old were you when you were first told,X2311F_II,0,
BACH2PUBLICUSE,,FIBROAGE_1,1,8,414,FOFB: E1ooi. Ever told you had: Fibromyalgia: Age,X2311F_II,0,
BACH2PUBLICUSE,,FIBROID,1,8,1646,FOID: E3ll. Uterine fibroids,X2511F_II,0,
BACH2PUBLICUSE,,FIBROIDAGE_1,1,8,385,FOFB: E1wwi. Ever told you had: uterine fibroids: Age,X2311F_II,0,
BACH2PUBLICUSE,,FIBROID_1,1,8,1689,FOFB: E1ww. Ever told you had: uterine fibroids,X2506F_II,0,
BACH2PUBLICUSE,,FIBRO_1,1,8,1262,FOFB: E1oo. Ever told you had: Fibromyalgia,X2506F_II,0,
BACH2PUBLICUSE,,FIBRTX,1,8,140,FOID: E3lli. Have you ever or are you currently receiving treatment,X2501F_II,0,
BACH2PUBLICUSE,,FKNELFT_M,1,8,592,PAIN: C24b. Front Knee Left: most pain,X2505F_II,0,
BACH2PUBLICUSE,,FKNELFT_S,1,8,591,PAIN: C24a. Front Knee Left: shaded pain,X2505F_II,0,
BACH2PUBLICUSE,,FKNERT_M,1,8,590,PAIN: C23b. Front Knee Right: most pain,X2505F_II,0,
BACH2PUBLICUSE,,FKNERT_S,1,8,589,PAIN: C23a. Front Knee Right: shaded pain,X2505F_II,0,
BACH2PUBLICUSE,,FL4SDSIN,1,8,1072,FOSM: PM1. How often did you feel sexual desire or interest,X2368F_II,0,
BACH2PUBLICUSE,,FLEGLFT_M,1,8,596,PAIN: C26b. Front Lower Leg Left: most pain,X2505F_II,0,
BACH2PUBLICUSE,,FLEGLFT_S,1,8,595,PAIN: C26a. Front Lower Leg Left: shaded pain,X2505F_II,0,
BACH2PUBLICUSE,,FLEGRT_M,1,8,594,PAIN: C25b. Front Lower Leg Right: most pain,X2505F_II,0,
BACH2PUBLICUSE,,FLEGRT_S,1,8,593,PAIN: C25a. Front Lower Leg Right: shaded pain,X2505F_II,0,
BACH2PUBLICUSE,,FLOEND4_1,1,8,1404,FOFD: J1hiii. Past 4 weeks problem for you: prolonged trickle,X2441F_II,0,
BACH2PUBLICUSE,,FLOENDDUR_1,1,8,1403,FOFD: J1hii. How long have you had this experience: prolonged trickle,X2351F_II,0,
BACH2PUBLICUSE,,FLOENDFRQ_1,1,8,1402,FOFD: J1hi. Would you say: prolonged trickle,X2406F_II,0,
BACH2PUBLICUSE,,FLOENDHEP_1,1,8,1405,FOFD: J1hiv. Seen provider for this symptom: prolonged trickle,X2506F_II,0,
BACH2PUBLICUSE,,FLOENDTRT_1,1,8,1406,FOFD: J1hv. IF YES: Did you receive treatment: prolonged trickle,X2465F_II,0,
BACH2PUBLICUSE,,FLUIDIN,1,8,1033,FOIG: K5h. Overall fluid intake?,X2336F_II,0,
BACH2PUBLICUSE,,FNECK_M,1,8,550,PAIN: C3b. Front Neck: most pain,X2505F_II,0,
BACH2PUBLICUSE,,FNECK_S,1,8,549,PAIN: C3a. Front Neck: shaded pain,X2505F_II,0,
BACH2PUBLICUSE,,FOAMEVR,1,8,831,FOIC: D1d. Ever used foams,X2506F_II,0,
BACH2PUBLICUSE,,FOAMEVR_1,1,8,1270,FOFC: F1d. Have you and your partner ever used : Foams,X2506F_II,0,
BACH2PUBLICUSE,,FOAMNOW,1,8,832,FOIC: D1di. Are you or your partner currently using this method,X2506F_II,0,
BACH2PUBLICUSE,,FOAMNOW_1,1,8,1271,FOFC: F1di. If Yes: Are you and your partner currently using this method,X2506F_II,0,
BACH2PUBLICUSE,,FOREHEAD_M,1,8,546,PAIN: C1b. Forehead: most pain,X2505F_II,0,
BACH2PUBLICUSE,,FOREHEAD_S,1,8,545,PAIN: C1a. Forehead: shaded pain,X2505F_II,0,
BACH2PUBLICUSE,,FREEHOS_1,1,8,1252,FOFB: E7e. For regular care you go to: A Free clinic,X2506F_II,0,
BACH2PUBLICUSE,,FREE_T,1,8,283,"Free testosterone, pg/mL",BEST,12,
BACH2PUBLICUSE,,FRQU4_1,1,8,1374,FOFD: J1biii. Past 4 weeks problem for you: less than 2 hours,X2441F_II,0,
BACH2PUBLICUSE,,FRQUDUR,1,8,980,FOIG: K1bii. How long?,X2325F_II,0,
BACH2PUBLICUSE,,FRQUDUR_1,1,8,1373,FOFD: J1bii. How long have you had this experience: less than 2 hrs,X2351F_II,0,
BACH2PUBLICUSE,,FRQUFRQ,1,8,979,FOIG: K1bi. To urinate again less than 2 hours?,X2330F_II,0,
BACH2PUBLICUSE,,FRQUFRQ_1,1,8,1372,FOFD: J1bi. Would you say: less than 2 hours,X2406F_II,0,
BACH2PUBLICUSE,,FRQUHEP_1,1,8,1375,FOFD: J1biv. Seen a provider for this symptom: less than 2 hours,X2506F_II,0,
BACH2PUBLICUSE,,FRQUTRT_1,1,8,1376,FOFD: J1bv. IF YES: Did you receive treatment: less than 2 hours,X2465F_II,0,
BACH2PUBLICUSE,,FRQUZ4_1,1,8,1449,FOFD: J1qiii. Past 4 weeks problem for you: frequent urination day,X2441F_II,0,
BACH2PUBLICUSE,,FRQUZDUR,1,8,1008,FOIG: K1pii. How long?,X2325F_II,0,
BACH2PUBLICUSE,,FRQUZDUR_1,1,8,1448,FOFD: J1qii. How long have you had this experience:frequent urination day,X2351F_II,0,
BACH2PUBLICUSE,,FRQUZFRQ,1,8,1007,FOIG: K1pi. Frequent urination during the day?,X2330F_II,0,
BACH2PUBLICUSE,,FRQUZFRQ_1,1,8,1447,FOFD: J1qi. Would you say: frequent urination day,X2406F_II,0,
BACH2PUBLICUSE,,FRQUZHEP_1,1,8,1450,FOFD: J1qiv. Seen provider for this symptom: frequent urination day,X2506F_II,0,
BACH2PUBLICUSE,,FRQUZTRT_1,1,8,1451,FOFD: J1qv. IF YES: Did you receive treatment: frequent urination day,X2465F_II,0,
BACH2PUBLICUSE,,FRSTLANG,1,8,1634,FOIG: L5. What is the first language you learned to speak?,X2327F_II,0,
BACH2PUBLICUSE,,FSBEATTHR_1,1,8,802,MSAQ/WSAQ: Your age when you first had physical abuse/threaten (Batch 2-5),X2311F_II,0,
BACH2PUBLICUSE,,FSCHDSX_1,1,8,696,"MSAQ/WSAQ: During childhood, your age when you first had unwanted sexual experiences (Batch 1)",X2311F_II,0,
BACH2PUBLICUSE,,FSEMLABS_1,1,8,806,MSAQ/WSAQ: Your age when you first had emotional abuse (Batch 2-5),X2311F_II,0,
BACH2PUBLICUSE,,FSH,1,8,1111,"Follicle-stimulating hormone, IU/L",,6,
BACH2PUBLICUSE,,FSHLFT_M,1,8,554,PAIN: C5b. Front Shoulder Left: most pain,X2505F_II,0,
BACH2PUBLICUSE,,FSHLFT_S,1,8,553,PAIN: C5a. Front Shoulder Left: shaded pain,X2505F_II,0,
BACH2PUBLICUSE,,FSHRT_M,1,8,552,PAIN: C4b. Front Shoulder Right: most pain,X2505F_II,0,
BACH2PUBLICUSE,,FSHRT_S,1,8,551,PAIN: C4a. Front Shoulder Right: shaded pain,X2505F_II,0,
BACH2PUBLICUSE,,FSTADPE_1,1,8,729,"MSAQ/WSAQ: During adulthood, your age when you first had physical/threat/emotional abuse (Batch 1)",X2311F_II,0,
BACH2PUBLICUSE,,FSTADSX_1,1,8,700,"MSAQ/WSAQ: During adulthood, your age when you first had unwanted sexual experiences (Batch 1)",X2311F_II,0,
BACH2PUBLICUSE,,FSTCHDPE_1,1,8,725,"MSAQ/WSAQ: During childhood, your age when you first had physical/threat/emotional abuse (Batch 1)",X2311F_II,0,
BACH2PUBLICUSE,,FSTLBTHYR_1,1,8,470,FOFC: G7a. How old were you at the time of your first live birth,X2311F_II,0,
BACH2PUBLICUSE,,FSTSX_1,1,8,800,MSAQ/WSAQ: Your age when you first had unwanted sexual experiences (Batch 2-5),X2311F_II,0,
BACH2PUBLICUSE,,FTHILFT_M,1,8,588,PAIN: C22b. Front Thigh Left: most pain,X2505F_II,0,
BACH2PUBLICUSE,,FTHILFT_S,1,8,587,PAIN: C22a. Front Thigh Left: shaded pain,X2505F_II,0,
BACH2PUBLICUSE,,FTHIRT_M,1,8,586,PAIN: C21b. Front Thigh Right: most pain,X2505F_II,0,
BACH2PUBLICUSE,,FTHIRT_S,1,8,585,PAIN: C21a. Front Thigh Right: shaded pain,X2505F_II,0,
BACH2PUBLICUSE,,FULLTIME,1,8,1065,FOIG: L10. Are you working 35 hours more or less each week?,X2324F_II,0,
BACH2PUBLICUSE,,FULLTIME_1,1,8,1544,FOFE: K5. Working more or less than 35 hours each weak,X2347F_II,0,
BACH2PUBLICUSE,,FWRSTLFT_M,1,8,570,PAIN: C13b. Front Wrist Left: most pain,X2505F_II,0,
BACH2PUBLICUSE,,FWRSTLFT_S,1,8,569,PAIN: C13a. Front Wrist Left: shaded pain,X2505F_II,0,
BACH2PUBLICUSE,,FWRSTRT_M,1,8,568,PAIN: C12b. Front Wrist Right: most pain,X2505F_II,0,
BACH2PUBLICUSE,,FWRSTRT_S,1,8,567,PAIN: C12a. Front Wrist Right: shaded pain,X2505F_II,0,
BACH2PUBLICUSE,,GARDEN,1,8,923,FOIE: F4c. Outdoor gardening,X2506F_II,0,
BACH2PUBLICUSE,,GARDEN_1,1,8,1159,FOFA: D4c. Last seven days: Outdoor gardening,X2496F_II,0,
BACH2PUBLICUSE,,GDIAB,1,8,1641,FOID: E3gg. Gestational diabetes,X2511F_II,0,
BACH2PUBLICUSE,,GDIABAGE,1,8,131,FOID: E3ggii. How old were you when you were first told,X2311F_II,0,
BACH2PUBLICUSE,,GDIABAGE_1,1,8,380,FOFB: E1rri. Ever told you had: Gestational Diabetes: Age,X2311F_II,0,
BACH2PUBLICUSE,,GDIABTX,1,8,130,FOID: E3ggi. Have you ever or are you currently receiving treatment,X2501F_II,0,
BACH2PUBLICUSE,,GDIAB_1,1,8,1684,FOFB: E1rr. Ever told you had: Gestational Diabetes,X2506F_II,0,
BACH2PUBLICUSE,,GENDER,1,8,811,FOIA: A5. Sex of respondent,X2428F_II,0,
BACH2PUBLICUSE,,GENDER_1,1,8,313,FOFA: A5. Sex of respondent,X2424F_II,0,
BACH2PUBLICUSE,,GENHERP,1,8,934,FOIF: G2c. Genital herpes,X2506F_II,0,
BACH2PUBLICUSE,,GENHERP_1,1,8,1280,FOFC: G2b. Have you ever been told you had: Genital Herpes,X2507F_II,0,
BACH2PUBLICUSE,,GEN_M,1,8,606,PAIN: C31b. Genitalia: most pain,X2505F_II,0,
BACH2PUBLICUSE,,GEN_S,1,8,605,PAIN: C31a. Genitalia: shaded pain,X2505F_II,0,
BACH2PUBLICUSE,,GOINGOUT,1,8,1032,"FOIG: K5g. Going to movies, shows, church, etc?",X2336F_II,0,
BACH2PUBLICUSE,,GOINGOUT_1,1,8,1500,"FOFD: J5g. Going to movies, shows, church, etc.",X2444F_II,0,
BACH2PUBLICUSE,,GONORRH,1,8,936,FOIF: G2e. Gonorrhea,X2506F_II,0,
BACH2PUBLICUSE,,GONORRH_1,1,8,1282,FOFC: G2e. Have you ever been told you had: Gonorrhea,X2507F_II,0,
BACH2PUBLICUSE,,GSTONES_1,1,8,1239,FOFB: E5a. Ever told you had: Gallstones,X2506F_II,0,
BACH2PUBLICUSE,,GSTONES_AGE1,1,8,402,FOFB: E5d. How old were you when you had gallbladder surgery: Age,X2311F_II,0,
BACH2PUBLICUSE,,GSTONES_SUR1,1,8,401,FOFB: E5c. Ever had: Gallbladder surgery,X2506F_II,0,
BACH2PUBLICUSE,,GSTONES_TRT1,1,8,400,FOFB: E5b. Ever had: Gallstones removed or dissolved,X2506F_II,0,
BACH2PUBLICUSE,,H20,1,8,969,FOIF: J12a. Water,X2311F_II,0,
BACH2PUBLICUSE,,H2O_1,1,8,1349,FOFC: I14a. In last 7 days: How many glasses of water you had,X2311F_II,0,
BACH2PUBLICUSE,,HBP,1,8,856,FOID: E3x. High blood pressure,X2511F_II,0,
BACH2PUBLICUSE,,HBPAGE,1,8,111,FOID: E3xii. How old were you when you were first told,X2311F_II,0,
BACH2PUBLICUSE,,HBPAGE_1,1,8,376,FOFB: E1kki. Ever told you had: High Blood Pressure: Age,X2311F_II,0,
BACH2PUBLICUSE,,HBPTX,1,8,110,FOID: E3xi. Have you ever or are you currently receiving treatment,X2501F_II,0,
BACH2PUBLICUSE,,HBP_1,1,8,1219,FOFB: E1kk. Ever told you had: High Blood Pressure,X2506F_II,0,
BACH2PUBLICUSE,,HCPFLARE,1,8,880,FOIE: E8c. A flare-up of an ongoing problem,X2506F_II,0,
BACH2PUBLICUSE,,HCPFLARE_1,1,8,1256,FOFB: E9c. Reason for visit: A Flare-up of an ongoing problem,X2506F_II,0,
BACH2PUBLICUSE,,HCPOTH,1,8,882,FOIE: E8e. Non-illness care,X2506F_II,0,
BACH2PUBLICUSE,,HCPOTH_1,1,8,1258,FOFB: E9e. Reason for visit: Non illness care,X2506F_II,0,
BACH2PUBLICUSE,,HCPROUT,1,8,879,FOIE: E8b. A routine visit for an ongoing problem,X2506F_II,0,
BACH2PUBLICUSE,,HCPROUT_1,1,8,1255,FOFB: E9b. Reason for visit: A Routine visit for ongoing problem,X2506F_II,0,
BACH2PUBLICUSE,,HCPSURG,1,8,881,FOIE: E8d. Pre- or post-surgery/injury care,X2506F_II,0,
BACH2PUBLICUSE,,HCPSURG_1,1,8,1257,FOFB: E9d. Reason for visit: A Pre/Post surgery care,X2506F_II,0,
BACH2PUBLICUSE,,HCPURG,1,8,878,FOIE: E8a. An urgent (acute) problem,X2506F_II,0,
BACH2PUBLICUSE,,HCPURG_1,1,8,1254,FOFB: E9a. Reason for visit: An urgent problem,X2506F_II,0,
BACH2PUBLICUSE,,HDLC_MGDL,1,8,1106,"High density lipoprotein cholestero,l mg/dL",,7,
BACH2PUBLICUSE,,HEADACHE,1,8,1059,FOIG: K18. Have you recently been bothered by headaches?,X2506F_II,0,
BACH2PUBLICUSE,,HEAD_M,1,8,608,PAIN: C32b. Head: most pain,X2505F_II,0,
BACH2PUBLICUSE,,HEAD_S,1,8,607,PAIN: C32a. Head: shaded pain,X2505F_II,0,
BACH2PUBLICUSE,,HEALTHCTR_1,1,8,1263,FOFB: E7d. For regular care you go to: A Health Center,X2506F_II,0,
BACH2PUBLICUSE,,HEARTMED,1,8,17,FOIB: C2b. Any medication for your heart or heart beat,X2506F_II,0,
BACH2PUBLICUSE,,HEARTMED_1,1,8,666,FOFA: D2b. Anything for your heart or heart beat,X2506F_II,0,
BACH2PUBLICUSE,,HERBOTC,1,8,40,FOIC: C3g. Any herbal or natural medicines,X2506F_II,0,
BACH2PUBLICUSE,,HERBOTC_1,1,8,690,FOFA: D3g. Last four weeks: Any herbal medications,X2506F_II,0,
BACH2PUBLICUSE,,HERBTEA,1,8,975,FOIF: J12g. Herbal tea,X2311F_II,0,
BACH2PUBLICUSE,,HERNAGE,1,8,217,"FOIF: G1ai. If yes, how old were you?",X2311F_II,0,
BACH2PUBLICUSE,,HERNAGE_1,1,8,432,FOFC: G1ai. How old were you at the time of surgery:Age,X2311F_II,0,
BACH2PUBLICUSE,,HERNREP,1,8,928,FOIF: G1a. Male only: Hernia repair,X2506F_II,0,
BACH2PUBLICUSE,,HERNREP_1,1,8,1272,FOFC: G1a. Have you seen HealthCare Provider For: Hernia Repair,X2506F_II,0,
BACH2PUBLICUSE,,HGHT00,1,8,268,FOPM: B1. Height - use HT_MI instead,X2311F_II,0,
BACH2PUBLICUSE,,HIP,1,8,870,FOIE: E5a. Hip,X2506F_II,0,
BACH2PUBLICUSE,,HIPAGE,1,8,148,FOIE: E5aii. Age (hip),X2311F_II,0,
BACH2PUBLICUSE,,HIPCM00,1,8,275,FOPM: B4. Hip circumference - use HIP_MI isntead,X2311F_II,0,
BACH2PUBLICUSE,,HIPLFT_M,1,8,584,PAIN: C20b. Hip Left: most pain,X2505F_II,0,
BACH2PUBLICUSE,,HIPLFT_S,1,8,583,PAIN: C20a. Hip Left: shaded pain,X2505F_II,0,
BACH2PUBLICUSE,,HIPRT_M,1,8,582,PAIN: C19b. Hip Right: most pain,X2505F_II,0,
BACH2PUBLICUSE,,HIPRT_S,1,8,581,PAIN: C19a. Hip Right: shaded pain,X2505F_II,0,
BACH2PUBLICUSE,,HIPTIME,1,8,147,FOIE: E5ai. Times (hip),X2311F_II,0,
BACH2PUBLICUSE,,HIPUN00,1,8,276,FOPM: B4a. Measurement taken in,X2423F_II,0,
BACH2PUBLICUSE,,HIPWHY,1,8,149,FOIE: E5aiii. Why (hip),X2376F_II,0,
BACH2PUBLICUSE,,HISPANIC,1,8,241,"FOIG: L3. Do you consider yourself to be Spanish, Hispanic or Latino?",X2506F_II,0,
BACH2PUBLICUSE,,HISPDK,1,8,250,FOIG: L4i. Don't know,X2506F_II,0,
BACH2PUBLICUSE,,HISPREF,1,8,251,FOIG: L4j. Refused,X2506F_II,0,
BACH2PUBLICUSE,,HIV,1,8,938,FOIF: G2g. HIV or AIDS,X2506F_II,0,
BACH2PUBLICUSE,,HIV_1,1,8,1284,FOFC: G2f. Have you ever been told you had: HIV,X2507F_II,0,
BACH2PUBLICUSE,,HMO,1,8,886,FOIE: E10a2. An HMO,X2506F_II,0,
BACH2PUBLICUSE,,HMONS,1,8,897,FOIE: E11i. Health Maintenance Organization,X2506F_II,0,
BACH2PUBLICUSE,,HMOPAY,1,8,196,FOIE: E11i2. Is your HMO primarily paid for by,X2515F_II,0,
BACH2PUBLICUSE,,HMO_1,1,8,404,FOFB: E7a2. For regular care you go to: A HMO,X2506F_II,0,
BACH2PUBLICUSE,,HMO_1_H,1,8,403,FOFB: E6h. Health Insurance: HMO,X2506F_II,0,
BACH2PUBLICUSE,,HOMEREP,1,8,921,FOIE: F4a. Home repairs,X2506F_II,0,
BACH2PUBLICUSE,,HOMEREP_1,1,8,1157,FOFA: D4a. Last seven days: Home repairs,X2496F_II,0,
BACH2PUBLICUSE,,HORMONE_1,1,8,440,FOFC: G4. Have you taken any female hormones,X2509F_II,0,
BACH2PUBLICUSE,,HOSPER,1,8,887,FOIE: E10a3. A hospital emergency room,X2506F_II,0,
BACH2PUBLICUSE,,HOSPER_1,1,8,1250,FOFB: E7b. For regular care you go to: A Hospital emergency room,X2506F_II,0,
BACH2PUBLICUSE,,HOUTPAT,1,8,888,FOIE: E10a4. A hospital outpatient clinic,X2506F_II,0,
BACH2PUBLICUSE,,HOUTPAT_1,1,8,1251,FOFB: E7c. For regular care you go to: A Hospital outpatient clinic,X2506F_II,0,
BACH2PUBLICUSE,,HOWHYST,1,8,222,FOIF: G3a1. Was this surgery done through the abdomen or vagina?,X2353F_II,0,
BACH2PUBLICUSE,,HPV,1,8,937,FOIF: G2f. HPV or genital warts,X2506F_II,0,
BACH2PUBLICUSE,,HPV_1,1,8,1283,FOFC: G2c. Have you ever been told you had: HPV or Genital warts,X2507F_II,0,
BACH2PUBLICUSE,,HRD,1,8,851,FOID: E3s. Heart-rhythm disturbance,X2511F_II,0,
BACH2PUBLICUSE,,HRDAGE,1,8,101,FOID: E3sii. How old were you when you were first told,X2311F_II,0,
BACH2PUBLICUSE,,HRDAGE_1,1,8,371,FOFB: E1ffi. Ever told you had: Heart rhythm disturbance: Age,X2311F_II,0,
BACH2PUBLICUSE,,HRDTX,1,8,100,FOID: E3si. Have you ever or are you currently receiving treatment,X2501F_II,0,
BACH2PUBLICUSE,,HRD_1,1,8,1214,FOFB: E1ff. Ever told you had: heart rhythm disturbance,X2506F_II,0,
BACH2PUBLICUSE,,HRS7DY,1,8,926,FOIE: F5a. How many hours did you work or volunteer,X2311F_II,0,
BACH2PUBLICUSE,,HRS7DY_1,1,8,1162,FOFA: D5a. Last seven days: Hours per week work for pay/volunteer,X2311F_II,0,
BACH2PUBLICUSE,,HRSLEEP_1,1,8,1316,FOFC: H17a. How many hours of actual sleep you get at night,X2311F_II,0,
BACH2PUBLICUSE,,HTS_FT00,1,8,269,FOPM: B1a1. Self-reported height (ft.),X2311F_II,0,
BACH2PUBLICUSE,,HTS_IN00,1,8,270,FOPM: B1a2. Self-reported height (in.),X2311F_II,0,
BACH2PUBLICUSE,,HVHSWORK,1,8,920,FOIE: F3. Have you done any heavy housework,X2506F_II,0,
BACH2PUBLICUSE,,HVHSWORK_1,1,8,1156,FOFA: D3. Last seven days have you done any heavy housework,X2496F_II,0,
BACH2PUBLICUSE,,HYPOGOAGE_1,1,8,396,FOFB: E2ci. Ever told you had: Hypogonadism: Age,X2311F_II,0,
BACH2PUBLICUSE,,HYPOGO_1,1,8,1229,FOFB: E2c. Ever told you had: Hypogonadism,X2506F_II,0,
BACH2PUBLICUSE,,HYSTER,1,8,1650,FOIF: G3a. Female only: A hysterectomy...?,X2506F_II,0,
BACH2PUBLICUSE,,HYSTERAGE_1,1,8,441,FOFC: G5ai. How old were you at the time of surgery:Age,X2311F_II,0,
BACH2PUBLICUSE,,HYSTER_1,1,8,1700,FOFC: G5a. Have you ever had: A Hysterectomy,X2512F_II,0,
BACH2PUBLICUSE,,IBSAGE_1,1,8,408,FOFB: E1qqi. Ever told you had: Irritable Bowel Syndrome:Age,X2311F_II,0,
BACH2PUBLICUSE,,IBS_1,1,8,1261,FOFB: E1qq. Ever told you had: Irritable Bowel Syndrome,X2506F_II,0,
BACH2PUBLICUSE,,ICAGE_1,1,8,390,FOFB: E2fi. Ever told you had: interstitial cystitis: Age,X2311F_II,0,
BACH2PUBLICUSE,,IC_1,1,8,1224,FOFB: E2f. Ever told you had: interstitial cystitis,X2506F_II,0,
BACH2PUBLICUSE,,INCOMEH,1,8,1071,FOIG: L14. Income,INCOMEHF_II,0,
BACH2PUBLICUSE,,INCOME_1,1,8,1550,FOFE: K9. Income,INCOME_1F_II,0,
BACH2PUBLICUSE,,INFERT,1,8,230,FOIF: G13. Have you ever tried to conceive a baby for 12 months?,X2506F_II,0,
BACH2PUBLICUSE,,INHALER_1,1,8,693,FOFE: L3si. Any inhalers,X2506F_II,0,
BACH2PUBLICUSE,,INJURIES_1,1,8,805,MSAQ/WSAQ: Suffer injuries (Batch 2-5),INJF,0,
BACH2PUBLICUSE,,INSULIN,1,8,22,FOIB: C2g. Insulin or pills for sugar in your blood,X2506F_II,0,
BACH2PUBLICUSE,,INSULIN_1,1,8,671,FOFA: D2g. Insulin or pills for sugar in your blood,X2506F_II,0,
BACH2PUBLICUSE,,INTCON_1,1,8,526,FOFE: K11a. Computer: How connect to internet,X2386F_II,0,
BACH2PUBLICUSE,,INTERNET_1,1,8,1553,FOFE: K11. Computer: internet connection,X2496F_II,0,
BACH2PUBLICUSE,,INTEVAL1,1,8,258,FOII: N1. Please rate how comfortable the REspondent was?,X2311F_II,0,
BACH2PUBLICUSE,,INTEVAL2,1,8,259,FOII: N2. Please rate how cooperative the Respondent was?,X2311F_II,0,
BACH2PUBLICUSE,,INTEVAL3,1,8,260,"FOII: N3. In general, how difficult was it for the Respondent...?",X2311F_II,0,
BACH2PUBLICUSE,,INTEVAL4,1,8,261,FOII: N4. Did the Respondent have difficulty answering the questions?,X2506F_II,0,
BACH2PUBLICUSE,,INTEVAL5,1,8,262,FOII: N5. Did you feel that the Respondent gave inaccurate ...?,X2506F_II,0,
BACH2PUBLICUSE,,INTEVAL6,1,8,263,FOII: N6. Were there any unusual circumstances at the time...?,X2506F_II,0,
BACH2PUBLICUSE,,INTEVAL7,1,8,264,FOII: N7. Did the Respondent have a language literacy problem?,X2506F_II,0,
BACH2PUBLICUSE,,INTFPAIN,1,8,1025,"FOIG: K4. Over the last month, how much pain?",X2338F_II,0,
BACH2PUBLICUSE,,INTFPAIN_1,1,8,1493,"FOFD: J4. Over the last month, how much have urinary symptoms",X2451F_II,0,
BACH2PUBLICUSE,,INTSRCHDX_1,1,8,527,FOFE: K14bc. Internet: search: disease specific websites,X2496F_II,0,
BACH2PUBLICUSE,,INTSRCHEN_1,1,8,528,FOFE: K14ba. Internet: search: search engines,X2496F_II,0,
BACH2PUBLICUSE,,INTSRCHFQ_1,1,8,529,FOFE: K14a. Internet: search: health: how often?,X2355F_II,0,
BACH2PUBLICUSE,,INTSRCHGH_1,1,8,530,FOFE: K14bb. Internet: search: general health portals (e.g. WebMd),X2496F_II,0,
BACH2PUBLICUSE,,INTSRCH_1,1,8,1554,FOFE: K14. Internet: search: health,X2496F_II,0,
BACH2PUBLICUSE,,INTURPRB1_1,1,8,531,FOFE: K14c. Internet: search: info for urological problem,X2496F_II,0,
BACH2PUBLICUSE,,IUDAGE,1,8,51,FOIC: D2di. How old were you when you began using,X2311F_II,0,
BACH2PUBLICUSE,,IUDAGE_1,1,8,426,FOFC: F2di. How old were you when you began using?,X2311F_II,0,
BACH2PUBLICUSE,,IUDDUR,1,8,52,FOIC: D2dii. For how long altogether have you used,X2311F_II,0,
BACH2PUBLICUSE,,IUDDUR_1,1,8,427,FOFC: F2dii. For how long altogether have you used,X2311F_II,0,
BACH2PUBLICUSE,,IUDMIRAGE_1,1,8,513,FOFC: F2f1i. How old were you when you began using?,X2311F_II,0,
BACH2PUBLICUSE,,IUDMIRDUR_1,1,8,511,FOFC: F2f1ii. For how long altogether have you used,X2311F_II,0,
BACH2PUBLICUSE,,IUDMIRNOW_1,1,8,1723,FOFC: F2f1. Ever used IUD Mirena:If Yes: Is this Current?,X2503F_II,0,
BACH2PUBLICUSE,,IUDMIRUNT_1,1,8,508,FOFC: F2f1iii. Units,X2431F_II,0,
BACH2PUBLICUSE,,IUDNOW,1,8,1638,FOIC: D2d. Intrauterine device,X2499F_II,0,
BACH2PUBLICUSE,,IUDNOW_1,1,8,1697,FOFC: F2f. Ever used IUD:If Yes: Is this Current?,X2503F_II,0,
BACH2PUBLICUSE,,IUDOTHAGE_1,1,8,490,FOFC: F2f2i. How old were you when you began using?,X2311F_II,0,
BACH2PUBLICUSE,,IUDOTHDUR_1,1,8,516,FOFC: F2f2ii. For how long altogether have you used,X2311F_II,0,
BACH2PUBLICUSE,,IUDOTHNOW_1,1,8,1724,FOFC: F2f2. Ever used IUD Other:If Yes: Is this Current?,X2503F_II,0,
