MEMNAME,MEMLABEL,NAME,TYPE,LENGTH,VARNUM,LABEL,FORMAT,FORMATL,INFORMAT
BACH2PUBLICUSE,,SKCARE8,1,8,906,FOIE: E12h. Pain or discomfort in you perineum,X2398F_II,0,
BACH2PUBLICUSE,,SLEEP10_1,1,8,1315,FOFC: H15i. Past month: Do you feel exhausted for no reasons,X2360F_II,0,
BACH2PUBLICUSE,,SLEEP11_1,1,8,1364,FOFC: H15j. Past month: quit breathing during your sleep,X2360F_II,0,
BACH2PUBLICUSE,,SLEEP12_1,1,8,1362,FOFC: H15k. Past month: fall asleep while driving,X2360F_II,0,
BACH2PUBLICUSE,,SLEEP1_1,1,8,1306,FOFC: H15a. Past month: Did you have difficulty falling asleep,X2360F_II,0,
BACH2PUBLICUSE,,SLEEP2_1,1,8,1307,FOFC: H15b. Past month: Morning after getting up can you fall asleep,X2360F_II,0,
BACH2PUBLICUSE,,SLEEP3_1,1,8,1308,FOFC: H15c. Past month: Do you use sleeping pills,X2360F_II,0,
BACH2PUBLICUSE,,SLEEP4_1,1,8,1309,FOFC: H15d. Past month: Are you tired during wake up time,X2360F_II,0,
BACH2PUBLICUSE,,SLEEP5_1,1,8,1310,FOFC: H15e. Past month: Are you tired after sleeping,X2360F_II,0,
BACH2PUBLICUSE,,SLEEP6_1,1,8,1311,FOFC: H15f. Past month: Are you restless during night,X2360F_II,0,
BACH2PUBLICUSE,,SLEEP7_1,1,8,1312,FOFC: H15l. Past month: Do you snore and your fequency of snoring,X2360F_II,0,
BACH2PUBLICUSE,,SLEEP8_1,1,8,1313,FOFC: H15g. Past month: Do you get up during the night,X2360F_II,0,
BACH2PUBLICUSE,,SLEEP9_1,1,8,1314,FOFC: H15h. Past month: Do you suffer headaches in the morning,X2360F_II,0,
BACH2PUBLICUSE,,SLEEPOTC,1,8,35,FOIC: C3b. Anything for problems sleeping,X2506F_II,0,
BACH2PUBLICUSE,,SLEEPOTC_1,1,8,685,FOFA: D3b. Last four weeks: For sleep problems,X2506F_II,0,
BACH2PUBLICUSE,,SMOKHOME,1,8,236,FOIF: J6. Do you live with someone who smokes tabacco?,X2506F_II,0,
BACH2PUBLICUSE,,SMOKHOME_1,1,8,483,FOFC: I6. Do you live with someone  who smoke tobacco at home,X2506F_II,0,
BACH2PUBLICUSE,,SMOKWORK,1,8,237,FOIF: J7. Currently do you spend time at work or outside with smokers?,X2506F_II,0,
BACH2PUBLICUSE,,SMOKWORK_1,1,8,484,FOFC: I7. Do you spend time daily basis at work with people who smoke,X2506F_II,0,
BACH2PUBLICUSE,,SNORE1_1,1,8,1360,FOFC: H16a. Has your snoring bothered other people?,X2506F_II,0,
BACH2PUBLICUSE,,SNORE2_1,1,8,1366,FOFC: H16b. Has your snoring been described as?,X2464F_II,0,
BACH2PUBLICUSE,,SOAMER,1,8,247,FOIG: L4f. South American - updated elsewhere,X2506F_II,0,
BACH2PUBLICUSE,,SODA,1,8,971,FOIF: J12c. Soda,X2311F_II,0,
BACH2PUBLICUSE,,SODA_1,1,8,1352,FOFC: I14d. In last 7 days: How many glasses of caffenated soda,X2311F_II,0,
BACH2PUBLICUSE,,SPANISH,1,8,245,FOIG: L4d. Spanish - updated elsewhere,X2506F_II,0,
BACH2PUBLICUSE,,SPENAGE,1,8,221,"FOIF: G1di. If yes, what age?",X2311F_II,0,
BACH2PUBLICUSE,,SPENAGE_1,1,8,438,FOFC: G1fi. How old were you at the time of surgery:Age,X2311F_II,0,
BACH2PUBLICUSE,,SPENIS,1,8,932,FOIF: G1d. Surgery on the penis,X2506F_II,0,
BACH2PUBLICUSE,,SPENIS_1,1,8,1278,FOFC: G1f. Have you seen HealthCare Provider For: Surgery on Penis,X2506F_II,0,
BACH2PUBLICUSE,,SPINE,1,8,872,FOIE: E5c. Spine,X2506F_II,0,
BACH2PUBLICUSE,,SPNEAGE,1,8,154,FOIE: E5cii. Age (spine),X2311F_II,0,
BACH2PUBLICUSE,,SPNETIME,1,8,153,FOIE: E5ci. Times (spine),X2311F_II,0,
BACH2PUBLICUSE,,SPNEWHY,1,8,155,FOIE: E5ciii. Why (spine),X2376F_II,0,
BACH2PUBLICUSE,,SPST4_1,1,8,1379,FOFD: J1ciii. Past 4 weeks problem for you: stop and start,X2441F_II,0,
BACH2PUBLICUSE,,SPSTDUR,1,8,982,FOIG: K1cii. How long?,X2325F_II,0,
BACH2PUBLICUSE,,SPSTDUR_1,1,8,1378,FOFD: J1cii. How long have you had this experience: stop and start,X2351F_II,0,
BACH2PUBLICUSE,,SPSTFRQ,1,8,981,FOIG: K1ci. To stop and start several times?,X2330F_II,0,
BACH2PUBLICUSE,,SPSTFRQ_1,1,8,1377,FOFD: J1ci. Would you say: stop and start,X2406F_II,0,
BACH2PUBLICUSE,,SPSTHEP_1,1,8,1380,FOFD: J1civ. Seen a provider for this symptom: stop and start,X2506F_II,0,
BACH2PUBLICUSE,,SPSTTRT_1,1,8,1381,FOFD: J1cv. IF YES: Did you receive treatment: stop and start,X2465F_II,0,
BACH2PUBLICUSE,,SPVD,1,8,848,FOID: E3p. PVD Surgery,X2511F_II,0,
BACH2PUBLICUSE,,SPVDAGE,1,8,95,FOID: E3pii. How old were you when you were first told,X2311F_II,0,
BACH2PUBLICUSE,,SPVDTX,1,8,94,FOID: E3pi. Have you ever or are you currently receiving treatment,X2501F_II,0,
BACH2PUBLICUSE,,SPVD_1,1,8,1178,FOFB: E1c. Ever told you had: Surgery or angioplasty,X2506F_II,0,
BACH2PUBLICUSE,,SRTERCTB,1,8,1090,FOSM: PM15. When did you start having trouble getting an erection,X2350F_II,0,
BACH2PUBLICUSE,,SRTERCTB_1,1,8,1556,MSAQ: 15a. When did you start having trouble to keep an erection (Batch 1),X2349F_II,0,
BACH2PUBLICUSE,,ST4EMLCL,1,8,1081,FOSM: PM6. How satisfied have you been with emotional closeness,X2491F_II,0,
BACH2PUBLICUSE,,ST4OASX,1,8,1083,FOSM: PM8. How satisfied have you been with your overall sex life,X2491F_II,0,
BACH2PUBLICUSE,,ST4ORGS,1,8,1672,FOSW: PF9. How satisfied were you with your ability to reach orgasm,X2491F_II,0,
BACH2PUBLICUSE,,STOPMENO,1,8,1658,FOIF: G5a3. Menopause,X2506F_II,0,
BACH2PUBLICUSE,,STOPMENO_1,1,8,1715,FOFC: G8a1. Did they stop because of: menopause,X2508F_II,0,
BACH2PUBLICUSE,,STOPPREG,1,8,1657,FOIF: G5a2. Pregnancy or breastfeeding,X2506F_II,0,
BACH2PUBLICUSE,,STOPPREG_1,1,8,1714,FOFC: G8a2. Did they stop because of: pregnancy or breastfeeding,X2508F_II,0,
BACH2PUBLICUSE,,STOPTX,1,8,1656,"FOIF: G5a1. Medication, chemotherapy...",X2506F_II,0,
BACH2PUBLICUSE,,STOPTX_1,1,8,1713,FOFC: G8a3. Did they stop because of: medication/radiation/chemotherapy,X2508F_II,0,
BACH2PUBLICUSE,,STOPWTOT,1,8,1659,FOIF: G5a4. Severe weight loss or another reason,X2506F_II,0,
BACH2PUBLICUSE,,STOPWTOT_1,1,8,1716,FOFC: G8a4. Did they stop because of: weight loss or another reason,X2508F_II,0,
BACH2PUBLICUSE,,STOPYEAR_1,1,8,472,FOFC: G8b. Can you tell what year your periods stopped,X2311F_II,0,
BACH2PUBLICUSE,,STOPYEAR_age,1,8,1985,T1c. FOIF: G5b. At what age your periods stopped (yrs)?,,0,
BACH2PUBLICUSE,,STRATUM,1,8,810,Stratum,S_II,0,
BACH2PUBLICUSE,,STRBAGE,1,8,193,FOIE: E6d1iv. Brother's age (stroke),X2311F_II,0,
BACH2PUBLICUSE,,STRBRO,1,8,192,FOIE: E6div. Brother (stroke),X2511F_II,0,
BACH2PUBLICUSE,,STRENDUR,1,8,918,FOIE: F1fi. How many hours per day (exercise to increase strength),X2415F_II,0,
BACH2PUBLICUSE,,STRENDUR_1,1,8,1154,FOFA: D1fi. Seven days: Any exercise: Hours,X2415F_II,0,
BACH2PUBLICUSE,,STRENGTH,1,8,917,FOIE: F1f. How often did you (exercise to increase strength),X2317F_II,0,
BACH2PUBLICUSE,,STRENGTH_1,1,8,1153,FOFA: D1f. Seven days: Any exercise,X2316F_II,0,
BACH2PUBLICUSE,,STRESS1_1,1,8,1302,FOFC: H10. In last month: how often you felt unable to control things,X2315F_II,0,
BACH2PUBLICUSE,,STRESS2_1,1,8,1303,FOFC: H11. In last month:How often you felt confident handling problems,X2315F_II,0,
BACH2PUBLICUSE,,STRESS3_1,1,8,1304,FOFC: H12. In last month:How often you felt things going your way,X2315F_II,0,
BACH2PUBLICUSE,,STRESS4_1,1,8,1305,FOFC: H13. In last month:How often you felt difficulty piling up,X2315F_II,0,
BACH2PUBLICUSE,,STRFAGE,1,8,189,FOIE: E6d1ii. Father's age (stroke),X2311F_II,0,
BACH2PUBLICUSE,,STRKAGE,1,8,195,FOIE: E6d1v. Child's age (stroke),X2311F_II,0,
BACH2PUBLICUSE,,STRKID,1,8,194,FOIE: E6dv. Child (stroke),X2511F_II,0,
BACH2PUBLICUSE,,STRMA,1,8,186,FOIE: E6di. Mother (stroke),X2511F_II,0,
BACH2PUBLICUSE,,STRMAGE,1,8,187,FOIE: E6d1i. Mother's age (stroke),X2311F_II,0,
BACH2PUBLICUSE,,STROKAGE,1,8,89,FOID: E3mii. How old were you when you were first told,X2311F_II,0,
BACH2PUBLICUSE,,STROKE,1,8,845,FOID: E3m. Stroke,X2511F_II,0,
BACH2PUBLICUSE,,STROKE_1,1,8,1180,FOFB: E1e. Ever told you had: A stroke,X2506F_II,0,
BACH2PUBLICUSE,,STROKE_TRT1,1,8,1181,FOFB: E1e1. Ever told you had: A stroke: If yes,X2506F_II,0,
BACH2PUBLICUSE,,STROKFHX,1,8,876,FOIE: E6d. Stroke (is none circled),X2506F_II,0,
BACH2PUBLICUSE,,STROKTX,1,8,88,FOID: E3mi. Have you ever or are you currently receiving treatment,X2501F_II,0,
BACH2PUBLICUSE,,STRPA,1,8,188,FOIE: E6dii. Father (stroke),X2511F_II,0,
BACH2PUBLICUSE,,STRSAGE,1,8,191,FOIE: E6d1iii. Sister's age (stroke),X2311F_II,0,
BACH2PUBLICUSE,,STRSIS,1,8,190,FOIE: E6diii. Sister (stroke),X2511F_II,0,
BACH2PUBLICUSE,,STRTTM00,2,5,15,FOIA: A8. Start time of interview,,0,$
BACH2PUBLICUSE,,STRTTM00_1,2,5,315,FOFA: A8. Start time of interview,,0,$
BACH2PUBLICUSE,,STSPDUR,1,8,916,FOIE: F1ei. How many hours per day (engage in strenuous sport),X2415F_II,0,
BACH2PUBLICUSE,,STSPDUR_1,1,8,1152,FOFA: D1ei. Seven days: Strenuous sport: Hours,X2415F_II,0,
BACH2PUBLICUSE,,STSPORT,1,8,915,FOIE: F1e. How often did you (engage in strenuous sport),X2317F_II,0,
BACH2PUBLICUSE,,STSPORT_1,1,8,1151,FOFA: D1e. Seven days: Strenuous sport,X2316F_II,0,
BACH2PUBLICUSE,,STTIMSAQ,2,5,265,FOIJ: P1. Start time of SAQ:,,0,$
BACH2PUBLICUSE,,SUGAR,1,8,835,FOID: E3c. Elevated blood sugar,X2511F_II,0,
BACH2PUBLICUSE,,SUGARAGE,1,8,69,FOID: E3cii. How old were you when you were first told,X2311F_II,0,
BACH2PUBLICUSE,,SUGARTX,1,8,68,FOID: E3ci. Have you ever or are you currently receiving treatment,X2501F_II,0,
BACH2PUBLICUSE,,SUGAR_1,1,8,1205,FOFB: E1w. Ever told you had: Elevated blood sugar,X2506F_II,0,
BACH2PUBLICUSE,,SURAUT_1,1,8,447,FOFC: G5a3c. What was the reason for surgery:Abnormal Uterine Bleeding,X2314F_II,0,
BACH2PUBLICUSE,,SURBC_1,1,8,451,FOFC: G5a3g. What was the reason for surgery:Benign Cysts,X2314F_II,0,
BACH2PUBLICUSE,,SURCAN_1,1,8,445,FOFC: G5a3a. What was the reason for surgery:Cancer,X2314F_II,0,
BACH2PUBLICUSE,,SURCP_1,1,8,449,FOFC: G5a3e. What was the reason for surgery:Chronic Pain,X2314F_II,0,
BACH2PUBLICUSE,,SURENDO_1,1,8,448,FOFC: G5a3d. What was the reason for surgery:Endometriosis,X2314F_II,0,
BACH2PUBLICUSE,,SURGE4_1,1,8,1444,FOFD: J1piii. Past 4 weeks problem for you: immediate stong urge,X2441F_II,0,
BACH2PUBLICUSE,,SURGEDUR,1,8,1006,FOIG: K1oii. How long?,X2325F_II,0,
BACH2PUBLICUSE,,SURGEDUR_1,1,8,1443,FOFD: J1pii. How long have you had this experience: immediate stong urge,X2351F_II,0,
BACH2PUBLICUSE,,SURGEFRQ,1,8,1005,FOIG: K1oi. A strong urge or pressure to urinate immediately?,X2330F_II,0,
BACH2PUBLICUSE,,SURGEFRQ_1,1,8,1442,FOFD: J1pi. Would you say: immediate stong urge,X2406F_II,0,
BACH2PUBLICUSE,,SURGEHEP_1,1,8,1445,FOFD: J1piv. Seen provider for this symptom: immediate stong urge,X2506F_II,0,
BACH2PUBLICUSE,,SURGETRT_1,1,8,1446,FOFD: J1pv. IF YES: Did you receive treatment: immediate stong urge,X2465F_II,0,
BACH2PUBLICUSE,,SURGMETH_1,1,8,442,FOFC: G5a1. Was this surgery done through abdomen/vagina,X2354F_II,0,
BACH2PUBLICUSE,,SURGUI,1,8,1652,FOIF: G3c. Surgery for incontinence,X2506F_II,0,
BACH2PUBLICUSE,,SURGUIAGE_1,1,8,458,FOFC: G5ci. How old were you at the time of surgery:Age,X2311F_II,0,
BACH2PUBLICUSE,,SURGUI_1,1,8,1702,FOFC: G5c. Have you ever had: A Surgery for incontinence,X2497F_II,0,
BACH2PUBLICUSE,,SUROTH_1,1,8,452,FOFC: G5a3h. What was the reason for surgery:Other,X2314F_II,0,
BACH2PUBLICUSE,,SURPC_2,1,8,457,FOFC: G5b3e. What was the reason for surgery:To Prevent Cancer,X2314F_II,0,
BACH2PUBLICUSE,,SURUTF_1,1,8,446,FOFC: G5a3b. What was the reason for surgery:Uterine Fibroids,X2314F_II,0,
BACH2PUBLICUSE,,SURUTP_1,1,8,450,FOFC: G5a3f. What was the reason for surgery:Uterine Prolapse,X2314F_II,0,
BACH2PUBLICUSE,,SYMTHINK_1,1,8,1537,FOFD: J17. How much did you think about your urinary symptoms,X2447F_II,0,
BACH2PUBLICUSE,,SYPHILIS,1,8,935,FOIF: G2d. Syphilis,X2506F_II,0,
BACH2PUBLICUSE,,SYPHILIS_1,1,8,1281,FOFC: G2d. Have you ever been told you had: Syphilis,X2507F_II,0,
BACH2PUBLICUSE,,TEA,1,8,974,FOIF: J12f. Tea,X2311F_II,0,
BACH2PUBLICUSE,,TEA_1,1,8,1356,FOFC: I14g. In last 7 days: How many glasses of caffenated tea,X2311F_II,0,
BACH2PUBLICUSE,,TEST4_1,1,8,1429,FOFD: J1miii. Past 4 weeks problem for you: pain in testicles,X2441F_II,0,
BACH2PUBLICUSE,,TESTDUR,1,8,1002,FOIG: K1mii. How long?,X2325F_II,0,
BACH2PUBLICUSE,,TESTDUR_1,1,8,1428,FOFD: J1mii. How long have you had this experience: pain in testicles,X2351F_II,0,
BACH2PUBLICUSE,,TESTFRQ,1,8,1001,FOIG: K1mi. If Male:Pain or discomfort in your testicles?,X2330F_II,0,
BACH2PUBLICUSE,,TESTFRQ_1,1,8,1427,FOFD: J1mi. Would you say: pain in testicles,X2406F_II,0,
BACH2PUBLICUSE,,TESTHEP_1,1,8,1430,FOFD: J1miv. Seen provider for this symptom: pain in testicles,X2506F_II,0,
BACH2PUBLICUSE,,TESTTRT_1,1,8,1431,FOFD: J1mv. IF YES: Did you receive treatment: pain in testicles,X2465F_II,0,
BACH2PUBLICUSE,,TGGB_MGDL,1,8,1105,"Triglycerides, mg/dL",,5,
BACH2PUBLICUSE,,THYRMED,1,8,21,FOIB: C2f. Thyroid pills,X2506F_II,0,
BACH2PUBLICUSE,,THYRMED_1,1,8,670,FOFA: D2f. Thyroid pills,X2506F_II,0,
BACH2PUBLICUSE,,TIA,1,8,844,FOID: E3l. TIA or mild stroke,X2511F_II,0,
BACH2PUBLICUSE,,TIAAGE,1,8,87,FOID: E3lii. How old were you when you were first told,X2311F_II,0,
BACH2PUBLICUSE,,TIATX,1,8,86,FOID: E3li. Have you ever or are you currently receiving treatment,X2501F_II,0,
BACH2PUBLICUSE,,TIA_1,1,8,1179,FOFB: E1d. Ever told you had: A TIA or mild stroke,X2506F_II,0,
BACH2PUBLICUSE,,TIMEBEV_1,1,8,1365,FOFC: I15. Time of day did you drink the most beverages?,X2377F_II,0,
BACH2PUBLICUSE,,TIMEHCP,1,8,877,FOIE: E7. How many times did you see a health care provider?,X2311F_II,0,
BACH2PUBLICUSE,,TIMEHCP_1,1,8,1253,FOFB: E8. How many times in last year you saw  healthcare provider,X2311F_II,0,
BACH2PUBLICUSE,,TPEN4_1,1,8,1434,FOFD: J1niii. Past 4 weeks problem for you: pain tip of penis,X2441F_II,0,
BACH2PUBLICUSE,,TPENDUR,1,8,1004,FOIG: K1nii. How long?,X2325F_II,0,
BACH2PUBLICUSE,,TPENDUR_1,1,8,1433,FOFD: J1nii. How long have you had this experience: pain tip of penis,X2351F_II,0,
BACH2PUBLICUSE,,TPENFRQ,1,8,1003,FOIG: K1ni. If Male:Pain or discomfort at the tip of penis?,X2330F_II,0,
BACH2PUBLICUSE,,TPENFRQ_1,1,8,1432,FOFD: J1ni. Would you say: pain tip of penis,X2406F_II,0,
BACH2PUBLICUSE,,TPENHEP_1,1,8,1435,FOFD: J1niv. Seen provider for this symptom: pain tip of penis,X2506F_II,0,
BACH2PUBLICUSE,,TPENTRT_1,1,8,1436,FOFD: J1nv. IF YES: Did you receive treatment: pain tip of penis,X2465F_II,0,
BACH2PUBLICUSE,,TRFOOD,1,8,1070,FOIG: L13d. Food,X2506F_II,0,
BACH2PUBLICUSE,,TRFOOD_1,1,8,1549,FOFE: K8d. Food,X2506F_II,0,
BACH2PUBLICUSE,,TRHLTH,1,8,1069,FOIG: L13c. Health or medical care,X2506F_II,0,
BACH2PUBLICUSE,,TRHLTH_1,1,8,1548,"FOFE: K8c. Health or medical care, medications",X2506F_II,0,
BACH2PUBLICUSE,,TRHOUS,1,8,1068,FOIG: L13b. Housing,X2506F_II,0,
BACH2PUBLICUSE,,TRHOUS_1,1,8,1547,FOFE: K8b. Housing,X2506F_II,0,
BACH2PUBLICUSE,,TRTRANS,1,8,1067,FOIG: L13a. Transportation,X2506F_II,0,
BACH2PUBLICUSE,,TRTRANS_1,1,8,1546,FOFE: K8a. Transportation,X2506F_II,0,
BACH2PUBLICUSE,,TUBLIGAGE_1,1,8,461,FOFC: G5fi. How old were you at the time of surgery:Age,X2311F_II,0,
BACH2PUBLICUSE,,TUBLIG_1,1,8,1705,FOFC: G5f. Have you ever had: A Surgery for Tubal ligation,X2497F_II,0,
BACH2PUBLICUSE,,TUGAGE,1,8,57,FOIC: D2fi. How old were you when you began using,X2311F_II,0,
BACH2PUBLICUSE,,TUGDUR,1,8,58,FOIC: D2fii. For how long altogether have you used,X2311F_II,0,
BACH2PUBLICUSE,,TUGNOW,1,8,1640,FOIC: D2f. Tubal ligation,X2499F_II,0,
BACH2PUBLICUSE,,TUGUNT,1,8,59,FOIC: D2fiii. Units,X2431F_II,0,
BACH2PUBLICUSE,,UIAGE_1,1,8,389,FOFB: E2ei. Ever told you had: urinary incontinence: Age,X2311F_II,0,
BACH2PUBLICUSE,,UIEXERC,1,8,1046,FOIG: K14a1. Doing exercises to strengthen the muscles?,X2339F_II,0,
BACH2PUBLICUSE,,UIEXERC_1,1,8,1525,FOFD: J14b1. Doing exercises to strengthen the muscles near the bladder,X2506F_II,0,
BACH2PUBLICUSE,,UIMED,1,8,29,FOIB: C2n. Medications for urinary incontinence and/or urgency,X2506F_II,0,
BACH2PUBLICUSE,,UIMEDRX,1,8,1048,FOIG: K14a3. Taking a prescription medication,X2339F_II,0,
BACH2PUBLICUSE,,UIMEDRX_1,1,8,1527,FOFD: J14b3. Taking a prescription medication,X2506F_II,0,
BACH2PUBLICUSE,,UIMED_1,1,8,678,FOFA: D2n. Medications for urinary incontinence and/or urgency,X2506F_II,0,
BACH2PUBLICUSE,,UINOTX,1,8,1050,FOIG: K14a5. Not currently doing anything for incontinence,X2339F_II,0,
BACH2PUBLICUSE,,UINOTX_1,1,8,1529,FOFD: J14b5. Doing Nothing,X2506F_II,0,
BACH2PUBLICUSE,,UIOTHTX,1,8,1049,FOIG: K14a4. Using some other medical treatment?,X2339F_II,0,
BACH2PUBLICUSE,,UIOTHTX_1,1,8,1528,FOFD: J14b4. Using some other medical treatment,X2506F_II,0,
BACH2PUBLICUSE,,UIPADS,1,8,1043,"FOIG: K12. During a typical 24-hr periods, on average...",X2340F_II,0,
BACH2PUBLICUSE,,UIPADS_1,1,8,1521,FOFD: J12. How many pads do you use because they are wet or damp,X2516F_II,0,
BACH2PUBLICUSE,,UIPROT,1,8,1042,FOIG: K11. What type of protection do you use most often?,X2335F_II,0,
BACH2PUBLICUSE,,UIPROT_1,1,8,1520,FOFD: J11. What type of protection do you use most often,X2445F_II,0,
BACH2PUBLICUSE,,UIQOL1,1,8,1051,FOIG: K15a. Your ability to do household chores,X2338F_II,0,
BACH2PUBLICUSE,,UIQOL2,1,8,1052,FOIG: K15b. Physical recreational activities,X2338F_II,0,
BACH2PUBLICUSE,,UIQOL3,1,8,1053,FOIG: K15c. Entertainment activities,X2338F_II,0,
BACH2PUBLICUSE,,UIQOL4,1,8,1054,FOIG: K15d. Your ability to travel by car or bus,X2338F_II,0,
BACH2PUBLICUSE,,UIQOL5,1,8,1055,FOIG: K15e. Your participation in social activities,X2338F_II,0,
BACH2PUBLICUSE,,UIQOL6,1,8,1056,FOIG: K15f. Your emotional health,X2338F_II,0,
BACH2PUBLICUSE,,UIQOL7,1,8,1057,"FOIG: K16. In addition, does urine leakage cause you frustration?",X2338F_II,0,
BACH2PUBLICUSE,,UIQOL1_1,1,8,1530,"FOFD: J15a. Your ability to do household chores, such as cooking",X2449F_II,0,
BACH2PUBLICUSE,,UIQOL2_1,1,8,1531,"FOFD: J15b. Physical recreational activities, such as walking, swimming",X2449F_II,0,
BACH2PUBLICUSE,,UIQOL3_1,1,8,1532,FOFD: J15c. Entertainment activities such as going to a film or concert,X2449F_II,0,
BACH2PUBLICUSE,,UIQOL4_1,1,8,1533,FOFD: J15d. Your ability to travel by car or bus for distances greater,X2449F_II,0,
BACH2PUBLICUSE,,UIQOL5_1,1,8,1534,FOFD: J15e. Your participation in social activities outside your home,X2449F_II,0,
BACH2PUBLICUSE,,UIQOL6_1,1,8,1535,FOFD: J15f. Your emotional health,X2449F_II,0,
BACH2PUBLICUSE,,UIQOL7_1,1,8,1536,"FOFD: J16. Do urinary symptoms, etc. cause frustration",X2449F_II,0,
BACH2PUBLICUSE,,UITIMING,1,8,1047,FOIG: K14a2. Timing your urination?,X2339F_II,0,
BACH2PUBLICUSE,,UITIMING_1,1,8,1526,FOFD: J14b2. Timing your urination (bladder training),X2506F_II,0,
BACH2PUBLICUSE,,UI_1,1,8,1223,FOFB: E2e. Ever told you had: urinary incontinence,X2506F_II,0,
BACH2PUBLICUSE,,ULCERMED,1,8,18,"FOIB: C2c. Any medication for stomach ulcers, reflux, or heartburn",X2506F_II,0,
BACH2PUBLICUSE,,ULCERMED_1,1,8,667,FOFA: D2c. Anything for stomach ulcers,X2506F_II,0,
BACH2PUBLICUSE,,ULCER_1,1,8,1184,FOFB: E1h. Ever told you had: Stomach ulcers,X2506F_II,0,
BACH2PUBLICUSE,,ULCER_TRT1,1,8,1185,FOFB: E1h1. Ever told you had: Stomach ulcers: Age: If yes - diagnosed,X2506F_II,0,
BACH2PUBLICUSE,,UNFAIRLY_1,1,8,1363,FOFC: H14. How strongly agree or not with ' . . . treated unfairly',X2466F_II,0,
BACH2PUBLICUSE,,URGE,1,8,1024,FOIG: K3. Some people experience a strong urge or pressure to urinate,X2337F_II,0,
BACH2PUBLICUSE,,URGEA4_1,1,8,1489,FOFD: J2c. Past 4 weeks problem for you: strong urge last 7 days,X2441F_II,0,
BACH2PUBLICUSE,,URGEADUR_1,1,8,1488,FOFD: J2b. How long you had this experience: strong urge last 7 days,X2341F_II,0,
BACH2PUBLICUSE,,URGEAHEP_1,1,8,1490,FOFD: J2d. Seen provider for this symptom: strong urge last 7 days,X2506F_II,0,
BACH2PUBLICUSE,,URGEATRT_1,1,8,1491,FOFD: J2e. IF YES: Did you receive treatment: strong urge last 7 days,X2465F_II,0,
BACH2PUBLICUSE,,URGEA_1,1,8,1487,FOFD: J2. Would you say: strong urge last 7 days,X2448F_II,0,
BACH2PUBLICUSE,,URGEA_XDAY_1,1,8,518,FOFD: J2a. IF EVERYDAY: how many times per day?,X2311F_II,0,
BACH2PUBLICUSE,,URGEFREQ,1,8,240,FOIG: K3a. How many times a day?,X2311F_II,0,
BACH2PUBLICUSE,,URINDAY,1,8,1034,"FOIG: K6. In last 7 days, how many times/day you went to bathroom?",X2311F_II,0,
BACH2PUBLICUSE,,URINDAY_1,1,8,1501,FOFD: J6. How many times have you had to go to the bathroom,X2311F_II,0,
BACH2PUBLICUSE,,URINDY7DY_1,1,8,1502,FOFD: J6a. How much has this been a problem for you,X2439F_II,0,
BACH2PUBLICUSE,,URINNT,1,8,1035,"FOIG: K7. In the last 7 days, how many times/night went to bathroom?",X2311F_II,0,
BACH2PUBLICUSE,,URINNT7DY_1,1,8,1505,FOFD: J7a. How much has this been a problem for you,X2439F_II,0,
BACH2PUBLICUSE,,URINNT_1,1,8,1504,FOFD: J7. How many times have you had to go to the bathroom,X2311F_II,0,
BACH2PUBLICUSE,,URIOFTNDY_1,1,8,1503,FOFD: J6b. Do you feel that you urinate too often during the day,X2506F_II,0,
BACH2PUBLICUSE,,URIOFTNT_1,1,8,1506,FOFD: J7b. Do you feel that you get up too often during the night,X2506F_II,0,
BACH2PUBLICUSE,,URISYM_1,1,8,682,FOFA: D2r. Any medications for your urinary symptoms,X2506F_II,0,
BACH2PUBLICUSE,,UT12MO,1,8,866,FOIE: E4c1. Times diagnosed with bladder infection in the last 12 months,X2311F_II,0,
BACH2PUBLICUSE,,UT12MO_1,1,8,1234,FOFB: E3c1. How many times: Bladder infection in last 12 months,X2311F_II,0,
BACH2PUBLICUSE,,UTIEVR,1,8,867,FOIE: E4c2. Times diagnosed with bladder infection in your lifetime,X2311F_II,0,
BACH2PUBLICUSE,,UTIEVR_1,1,8,1235,FOFB: E3c2. How many times: Bladder infection in your lifetime,X2311F_II,0,
BACH2PUBLICUSE,,UTI_KI,1,8,865,FOIE: E4c. Ever been told you had a bladder or kidney infection,X2506F_II,0,
BACH2PUBLICUSE,,UTI_KI_1,1,8,1233,FOFB: E3c. Ever told you had: bladder infection or uti,X2506F_II,0,
BACH2PUBLICUSE,,VAGBRTH_1,1,8,1709,FOFC: G6c. How many of your live births resulted in vaginal delivery,X2311F_II,0,
BACH2PUBLICUSE,,VAGCSEC_1,1,8,1711,FOFC: G6e. How many live births resulted in both vaginal and C Section,X2311F_II,0,
BACH2PUBLICUSE,,VASAGE,1,8,218,"FOIF: G1bi. If yes, how old were you?",X2311F_II,0,
BACH2PUBLICUSE,,VASAGE_1,1,8,433,FOFC: G1bi. How old were you at the time of surgery:Age,X2311F_II,0,
BACH2PUBLICUSE,,VASECT,1,8,929,FOIF: G1b. Vasectomy,X2506F_II,0,
BACH2PUBLICUSE,,VASECT_1,1,8,1273,FOFC: G1b. Have you seen HealthCare Provider For: Vasectomy,X2506F_II,0,
BACH2PUBLICUSE,,WALK,1,8,909,FOIE: F1b. How often did you (take a walk),X2317F_II,0,
BACH2PUBLICUSE,,WALKDUR,1,8,910,FOIE: F1bi. How many hours per day (take a walk),X2415F_II,0,
BACH2PUBLICUSE,,WALKDUR_1,1,8,1146,FOFA: D1bi. Seven days: Walk outside: Hours,X2415F_II,0,
BACH2PUBLICUSE,,WALK_1,1,8,1145,FOFA: D1b. Seven days: Walk outside,X2316F_II,0,
BACH2PUBLICUSE,,WEAKU4_1,1,8,1389,FOFD: J1eiii. Past 4 weeks problem for you: weak stream,X2441F_II,0,
BACH2PUBLICUSE,,WEAKUDUR,1,8,986,FOIG: K1eii. How long?,X2325F_II,0,
BACH2PUBLICUSE,,WEAKUDUR_1,1,8,1388,FOFD: J1eii. How long have you had this experience: weak stream,X2351F_II,0,
BACH2PUBLICUSE,,WEAKUFRQ,1,8,985,FOIG: K1ei. A weak urinary stream?,X2330F_II,0,
BACH2PUBLICUSE,,WEAKUFRQ_1,1,8,1387,FOFD: J1ei. Would you say: weak stream,X2406F_II,0,
BACH2PUBLICUSE,,WEAKUHEP_1,1,8,1390,FOFD: J1eiv. Seen provider for this symptom: weak stream,X2506F_II,0,
BACH2PUBLICUSE,,WEAKUTRT_1,1,8,1391,FOFD: J1ev. IF YES: Did you receive treatment: weak stream,X2465F_II,0,
BACH2PUBLICUSE,,WETDUR,1,8,994,FOIG: K1iii. How long?,X2325F_II,0,
BACH2PUBLICUSE,,WETFRQ,1,8,993,FOIG: K1ii. Wet clothes because of dribbling after urination?,X2330F_II,0,
BACH2PUBLICUSE,,WGHT00,1,8,271,FOPM: B2. Weight - use WT_MI instead,X2311F_II,0,
BACH2PUBLICUSE,,WGHTS00,1,8,272,FOPM: B2a. Self-reported weight (lbs),X2311F_II,0,
BACH2PUBLICUSE,,WHITE,1,8,256,FOIG: L6e. White or Caucasian,X2506F_II,0,
BACH2PUBLICUSE,,WHITEC,1,8,12,INS1: C5e. Race: White,X2506F_II,0,
BACH2PUBLICUSE,,WHOSXAD,1,8,1091,FOSM: PM16. Which best describes who you have generally had sex with,WHOSXAD_II,0,
BACH2PUBLICUSE,,WHOSXAD_1,1,8,1576,MSAQ/WSAQ: Who you have generally had sex with over your adult life,WHOSXAD_II,0,
BACH2PUBLICUSE,,WINE30DY,1,8,963,"FOIF: J9b. Wine, wine coolers, sangria or champagne?",X2506F_II,0,
BACH2PUBLICUSE,,WINE30DY_1,1,8,1343,FOFC: I10b. In last 30 days : Wine/Wine Coolers/Sangria/Champagne,X2506F_II,0,
BACH2PUBLICUSE,,WINEFREQ,1,8,964,"FOIF: J9bi. If yes, how often?",X2328F_II,0,
BACH2PUBLICUSE,,WINEFREQ_1,1,8,1344,FOFC: I10bi. How often do you drink : Wine/ Wine Coolers/Champagne,X2392F_II,0,
BACH2PUBLICUSE,,WINEMEAL_1,1,8,515,FOFC: I10biii. Meal with : Wine/Wine Coolers/Sangria/Champagne,X2420F_II,0,
BACH2PUBLICUSE,,WINEVOL,1,8,965,"FOIF: J9bii. If yes, how much?",X2323F_II,0,
BACH2PUBLICUSE,,WINEVOL_1,1,8,1345,FOFC: I10bii. How much do you drink : Wine/Wine Coolers/Champagne,X2344F_II,0,
BACH2PUBLICUSE,,WORCHILD,1,8,950,FOIF: H9b3. A child?,X2506F_II,0,
BACH2PUBLICUSE,,WORCHILD_1,1,8,1298,FOFC: H9b3. Worry was caused by: A Child,X2506F_II,0,
BACH2PUBLICUSE,,WORK7DY,1,8,925,FOIE: F5. Did you work for pay or as a volunteer,X2506F_II,0,
BACH2PUBLICUSE,,WORK7DY_1,1,8,1161,FOFA: D5. Last seven days did you work for pay or volunteer,X2496F_II,0,
BACH2PUBLICUSE,,WORKCOMP,1,8,892,FOIE: E11d. Worker's compensation,X2506F_II,0,
BACH2PUBLICUSE,,WORKCOMP_1,1,8,1243,FOFB: E6f. Health Insurance: Worker's compensation,X2506F_II,0,
BACH2PUBLICUSE,,WORKSTAT,1,8,1064,FOIG: L9. Which describes best your current work situation?,X2495F_II,0,
BACH2PUBLICUSE,,WORKSTAT_1,1,8,1543,FOFE: K4. Your current work situation,X2494F_II,0,
BACH2PUBLICUSE,,WOROTH,1,8,952,FOIF: H9b5. Another relative or friend?,X2506F_II,0,
BACH2PUBLICUSE,,WOROTH_1,1,8,1300,FOFC: H9b5. Worry was caused by: Another Relative/Friend,X2506F_II,0,
BACH2PUBLICUSE,,WORPARNT,1,8,949,FOIF: H9b2. A parent?,X2506F_II,0,
BACH2PUBLICUSE,,WORPARNT_1,1,8,1297,FOFC: H9b2. Worry was caused by: A Parent,X2506F_II,0,
BACH2PUBLICUSE,,WORRY,1,8,947,"FOIF: H9a. In the last six months, has anyone close caused you worry ?",X2506F_II,0,
BACH2PUBLICUSE,,WORRY_1,1,8,1295,FOFC: H9a. In last 6 months: Anyone could have caused worry,X2506F_II,0,
BACH2PUBLICUSE,,WORSIB,1,8,951,FOIF: H9b4. A sibling?,X2506F_II,0,
BACH2PUBLICUSE,,WORSIB_1,1,8,1299,FOFC: H9b4. Worry was caused by: A Sibling,X2506F_II,0,
BACH2PUBLICUSE,,WORSPSE,1,8,948,FOIF: H9b1. A spouse or partner?,X2506F_II,0,
BACH2PUBLICUSE,,WORSPSE_1,1,8,1296,FOFC: H9b1. Worry was caused by: A Spouse/Partner,X2506F_II,0,
