MEMNAME,MEMLABEL,NAME,TYPE,LENGTH,VARNUM,LABEL,FORMAT,FORMATL,INFORMAT
BACH2PUBLICUSE,,AAG,1,8,1114,"Androstanediol glucoronide (3-alpha-diol G), nmol/L",,7,
BACH2PUBLICUSE,,ABDOMLO_M,1,8,580,PAIN: C18b. Abdomen Lower: most pain,X2505F_II,0,
BACH2PUBLICUSE,,ABDOMLO_S,1,8,579,PAIN: C18a. Abdomen Lower: shaded pain,X2505F_II,0,
BACH2PUBLICUSE,,ABDOM_M,1,8,578,PAIN: C17b. Abdomen Upper: most pain,X2505F_II,0,
BACH2PUBLICUSE,,ABDOM_S,1,8,577,PAIN: C17a. Abdomen Upper: shaded pain,X2505F_II,0,
BACH2PUBLICUSE,,ADADHMSX_1,1,8,708,MSAQ/WSAQ: During adulthood: unwanted /forced sexual experiences: other adult,X2506F_II,0,
BACH2PUBLICUSE,,ADANYONSX_1,1,8,724,MSAQ/WSAQ: During adulthood: unwanted /forced sexual experiences: anyone else,X2506F_II,0,
BACH2PUBLICUSE,,ADBEAT,1,8,1099,"FOSM: PM21a. Hit, kick, or beat you",X2433F_II,0,
BACH2PUBLICUSE,,ADBEAT_1,1,8,1598,MSAQ/WSAQ: During adulthood did any adult: hit/kick/beat you,X2433F_II,0,
BACH2PUBLICUSE,,ADBFGFPEA_1,1,8,767,MSAQ/WSAQ: During adulthood:Hit/kick/beat:boyfriend/girlfriend,X2506F_II,0,
BACH2PUBLICUSE,,ADBFGFPEB_1,1,8,768,MSAQ/WSAQ: During adulthood:seriously threaten life:boyfriend/girlfrien,X2506F_II,0,
BACH2PUBLICUSE,,ADBFGFPEC_1,1,8,769,MSAQ/WSAQ: During adulthood:emotionally abuse:other family member,X2506F_II,0,
BACH2PUBLICUSE,,ADBFGFSX_1,1,8,716,MSAQ/WSAQ: During adulthood: unwanted /forced sexual experiences: boyfriend/girlfriend,X2506F_II,0,
BACH2PUBLICUSE,,ADCAGE_1,1,8,462,FOFC: G5gi. How old were you at the time of surgery:Age,X2311F_II,0,
BACH2PUBLICUSE,,ADCNUM_1,1,8,463,FOFC: G5g1. If Yes: How many,X2311F_II,0,
BACH2PUBLICUSE,,ADC_1,1,8,1706,FOFC: G5g. Have you ever had: A D and C,X2497F_II,0,
BACH2PUBLICUSE,,ADEMLABS,1,8,1101,"FOSM: PM21c. Emotionally abuse, humiliate, or insult you",X2433F_II,0,
BACH2PUBLICUSE,,ADEMLABS_1,1,8,1600,MSAQ/WSAQ: During adulthood did any adult: emotionally abuse you,X2433F_II,0,
BACH2PUBLICUSE,,ADEXORG_1,1,8,1589,MSAQ/WSAQ: During adulthood: Any adult exposed sex organs,X2506F_II,0,
BACH2PUBLICUSE,,ADEXPORG,1,8,1093,FOSM: PM20a. Exposed the sex organ of their body to you,X2506F_II,0,
BACH2PUBLICUSE,,ADFRCSX,1,8,1097,FOSM: PM20e. Forced you to have sex,X2506F_II,0,
BACH2PUBLICUSE,,ADFRCSX_1,1,8,1593,MSAQ/WSAQ: During adulthood: Any adult forced you to have sex,X2506F_II,0,
BACH2PUBLICUSE,,ADGRDPEA_1,1,8,737,MSAQ/WSAQ: During adulthood:Hit/kick/beat: parent/stepparent,X2506F_II,0,
BACH2PUBLICUSE,,ADGRDPEB_1,1,8,738,MSAQ/WSAQ: During adulthood:seriously threaten life: parent/stepparent,X2506F_II,0,
BACH2PUBLICUSE,,ADGRDPEC_1,1,8,739,MSAQ/WSAQ: During adulthood:emotionally abuse:parent/stepparent,X2506F_II,0,
BACH2PUBLICUSE,,ADNEONEPEA_1,1,8,791,MSAQ/WSAQ: During adulthood:Hit/kick/beat:Anyone else,X2506F_II,0,
BACH2PUBLICUSE,,ADNEONEPEB_1,1,8,792,MSAQ/WSAQ: During adulthood:threaten life:Anyone else,X2506F_II,0,
BACH2PUBLICUSE,,ADNEONEPEC_1,1,8,793,MSAQ/WSAQ: During adulthood:emotionally abuse:Anyone else,X2506F_II,0,
BACH2PUBLICUSE,,ADOADDKSX_1,1,8,722,MSAQ/WSAQ: During adulthood: unwanted /forced sexual experiences: adult you dont know,X2506F_II,0,
BACH2PUBLICUSE,,ADOADHPEA_1,1,8,743,MSAQ/WSAQ: During adulthood:Hit/kick/beat: other adult in your home,X2506F_II,0,
BACH2PUBLICUSE,,ADOADHPEB_1,1,8,744,MSAQ/WSAQ: During adulthood:seriously threaten life:Other adult in home,X2506F_II,0,
BACH2PUBLICUSE,,ADOADHPEC_1,1,8,745,MSAQ/WSAQ: During adulthood:emotionally abuse:other adult in your home,X2506F_II,0,
BACH2PUBLICUSE,,ADOADKPEA_1,1,8,785,MSAQ/WSAQ: During adulthood:Hit/kick/beat:other adult you dont know,X2506F_II,0,
BACH2PUBLICUSE,,ADOADKPEB_1,1,8,786,MSAQ/WSAQ: During adulthood:threaten life:other adult you dont know,X2506F_II,0,
BACH2PUBLICUSE,,ADOADKPEC_1,1,8,787,MSAQ/WSAQ: During adulthood:emotionally abuse:adult you dont know,X2506F_II,0,
BACH2PUBLICUSE,,ADOADSX_1,1,8,720,MSAQ/WSAQ: During adulthood: unwanted /forced sexual experiences: other adult you knew,X2506F_II,0,
BACH2PUBLICUSE,,ADOFAMPEA_1,1,8,761,MSAQ/WSAQ: During adulthood:Hit/kick/beat:other family member,X2506F_II,0,
BACH2PUBLICUSE,,ADOFAMPEB_1,1,8,762,MSAQ/WSAQ: During adulthood:seriously threaten life:other family member,X2506F_II,0,
BACH2PUBLICUSE,,ADOFAMPEC_1,1,8,763,MSAQ/WSAQ: During adulthood:emotionally abuse:other family member,X2506F_II,0,
BACH2PUBLICUSE,,ADOFAMSX_1,1,8,714,MSAQ/WSAQ: During adulthood: unwanted /forced sexual experiences: other family member,X2506F_II,0,
BACH2PUBLICUSE,,ADOHUNSX,1,8,1098,FOSM: PM20f. Have you had any other unwanted sexual experiences,X2506F_II,0,
BACH2PUBLICUSE,,ADOHUNSX_1,1,8,1594,MSAQ/WSAQ: During adulthood: Had any unwanted sexual experiences,X2506F_II,0,
BACH2PUBLICUSE,,ADOTADPEA_1,1,8,779,MSAQ/WSAQ: During adulthood:Hit/kick/beat:other adult you knew,X2506F_II,0,
BACH2PUBLICUSE,,ADOTADPEB_1,1,8,780,MSAQ/WSAQ: During adulthood:seriously threaten life:other adult you kne,X2506F_II,0,
BACH2PUBLICUSE,,ADOTADPEC_1,1,8,781,MSAQ/WSAQ: During adulthood:emotionally abuse:other adult you knew,X2506F_II,0,
BACH2PUBLICUSE,,ADPE2YR_1,1,8,732,MSAQ/WSAQ: How many times did this physical/threat/emotional abuse happen in the last 2 years (Batch 1),X2311F_II,0,
BACH2PUBLICUSE,,ADPRTNRPEA_1,1,8,749,MSAQ/WSAQ: During adulthood:Hit/kick/beat: spouse/partner,X2506F_II,0,
BACH2PUBLICUSE,,ADPRTNRPEB_1,1,8,750,MSAQ/WSAQ: During adulthood:seriously threaten life:spouse/partner,X2506F_II,0,
BACH2PUBLICUSE,,ADPRTNRPEC_1,1,8,751,MSAQ/WSAQ: During adulthood:emotionally abuse:spouse/partner,X2506F_II,0,
BACH2PUBLICUSE,,ADRENTSX_1,1,8,706,MSAQ/WSAQ: During adulthood: unwanted /forced sexual experiences: parent/stepparent,X2506F_II,0,
BACH2PUBLICUSE,,ADSIBLINSX_1,1,8,712,MSAQ/WSAQ: During adulthood: unwanted /forced sexual experiences: sibling,X2506F_II,0,
BACH2PUBLICUSE,,ADSIBPEA_1,1,8,755,MSAQ/WSAQ: During adulthood: During adulthood:Hit/kick/beat:sibling,X2506F_II,0,
BACH2PUBLICUSE,,ADSIBPEB_1,1,8,756,MSAQ/WSAQ: During adulthood: During adulthood:seriously threaten life:sibling,X2506F_II,0,
BACH2PUBLICUSE,,ADSIBPEC_1,1,8,757,MSAQ/WSAQ: During adulthood: During adulthood:emotionally abuse:sibling,X2506F_II,0,
BACH2PUBLICUSE,,ADSPOUSESX_1,1,8,710,MSAQ/WSAQ: During adulthood: unwanted /forced sexual experiences: spouse/partner,X2506F_II,0,
BACH2PUBLICUSE,,ADSX2YR_1,1,8,703,MSAQ/WSAQ: How many times did this happen in the last 2 years. Batch 1 capped at 15 times.,,0,
BACH2PUBLICUSE,,ADTCHORG,1,8,1095,FOSM: PM20c. Touched the sex organs of your body,X2506F_II,0,
BACH2PUBLICUSE,,ADTCHORG_1,1,8,1591,MSAQ/WSAQ: During adulthood: Any adult touched your sex organs,X2506F_II,0,
BACH2PUBLICUSE,,ADTEENPEA_1,1,8,773,MSAQ/WSAQ: During adulthood:Hit/kick/beat:other teenager,X2506F_II,0,
BACH2PUBLICUSE,,ADTEENPEB_1,1,8,774,MSAQ/WSAQ: During adulthood:seriously threaten life:other teenager,X2506F_II,0,
BACH2PUBLICUSE,,ADTEENPEC_1,1,8,775,MSAQ/WSAQ: During adulthood:emotionally abuse:other teenager,X2506F_II,0,
BACH2PUBLICUSE,,ADTEENSX_1,1,8,718,MSAQ/WSAQ: During adulthood: unwanted /forced sexual experiences: other teenager,X2506F_II,0,
BACH2PUBLICUSE,,ADTHRLF_1,1,8,1599,MSAQ/WSAQ: During adulthood did any adult: seriously threaten you,X2433F_II,0,
BACH2PUBLICUSE,,ADTHRTLF,1,8,1100,FOSM: PM21b. Seriously threaten your life,X2433F_II,0,
BACH2PUBLICUSE,,ADTHRTSX,1,8,1094,FOSM: PM20b. Threatened to have sex with you,X2506F_II,0,
BACH2PUBLICUSE,,ADTHRTSX_1,1,8,1590,MSAQ/WSAQ: During adulthood: Any adult threathened to have sex,X2506F_II,0,
BACH2PUBLICUSE,,ADYUTCH,1,8,1096,FOSM: PM20d. Made you touch the sex organs of their body,X2506F_II,0,
BACH2PUBLICUSE,,ADYUTCH_1,1,8,1592,MSAQ/WSAQ: During adulthood: Any adult made you touch their sex organs,X2506F_II,0,
BACH2PUBLICUSE,,AIAN,1,8,252,FOIG: L6a. American Indian or Alaska Native,X2506F_II,0,
BACH2PUBLICUSE,,AIDS_1,1,8,1204,FOFB: E1v. Ever told you had: AIDS,X2506F_II,0,
BACH2PUBLICUSE,,ALCOH30DY_1,1,8,501,FOFC: I9. Have you  had an alcoholic drink in the past 30 days?,X2506F_II,0,
BACH2PUBLICUSE,,ALCOHUSE_1,1,8,505,FOFC: I13. Past 10 years has your use of alcoholic beaverages increased,X2411F_II,0,
BACH2PUBLICUSE,,ALLERAGE,1,8,75,FOID: E3fii. How old were you when you were first told,X2311F_II,0,
BACH2PUBLICUSE,,ALLERGY,1,8,838,FOID: E3f. Allergies or eczema,X2511F_II,0,
BACH2PUBLICUSE,,ALLERGY_1,1,8,1206,FOFB: E1x. Ever told you had: Allergies,X2506F_II,0,
BACH2PUBLICUSE,,ALLERTX,1,8,74,FOID: E3fi. Have you ever or are you currently receiving treatment,X2501F_II,0,
BACH2PUBLICUSE,,ALZHEIMERS_1,1,8,1199,FOFB: E1o. Ever told you had: Alzheimers,X2506F_II,0,
BACH2PUBLICUSE,,AMINALNC,1,8,8,INS1: C5a. Race: American Indian or Alaska Native,X2506F_II,0,
BACH2PUBLICUSE,,AMS01_1,1,8,1317,FOFC: H18a. Symptoms : Decline in your feeling of general well being,X2446F_II,0,
BACH2PUBLICUSE,,AMS02_1,1,8,1318,FOFC: H18b. Symptoms : Joint pain muscular ache,X2446F_II,0,
BACH2PUBLICUSE,,AMS03_1,1,8,1319,FOFC: H18c. Symptoms : Excessive Sweating,X2446F_II,0,
BACH2PUBLICUSE,,AMS04_1,1,8,1320,FOFC: H18d. Symptoms : Sleep Problems,X2446F_II,0,
BACH2PUBLICUSE,,AMS05_1,1,8,1321,FOFC: H18e. Symptoms : Increased need for sleep,X2446F_II,0,
BACH2PUBLICUSE,,AMS06_1,1,8,1322,FOFC: H18f. Symptoms : Irritability,X2446F_II,0,
BACH2PUBLICUSE,,AMS07_1,1,8,1323,FOFC: H18g. Symptoms :Nervousness,X2446F_II,0,
BACH2PUBLICUSE,,AMS08_1,1,8,1324,FOFC: H18h. Symptoms : Anxiety,X2446F_II,0,
BACH2PUBLICUSE,,AMS09_1,1,8,1325,FOFC: H18i. Symptoms : Physical Exhaustion/ Lacking Vitality,X2446F_II,0,
BACH2PUBLICUSE,,AMS10_1,1,8,1326,FOFC: H18j. Symptoms : Decrease in muscular strength,X2446F_II,0,
BACH2PUBLICUSE,,AMS11_1,1,8,1327,FOFC: H18k. Symptoms : Depressive mood,X2446F_II,0,
BACH2PUBLICUSE,,AMS12_1,1,8,1328,FOFC: H18l. Symptoms : Feeling that you have passed your peak,X2446F_II,0,
BACH2PUBLICUSE,,AMS13_1,1,8,1329,"FOFC: H18m. Symptoms : Feeling burn't out, having hit rock bottom",X2446F_II,0,
BACH2PUBLICUSE,,AMS14_1,1,8,1330,FOFC: H18q. Symptoms : Decrease in beard growth,X2446F_II,0,
BACH2PUBLICUSE,,AMS15_1,1,8,1331,FOFC: H18o. Symptoms : Decrease in ability to perform sexually,X2446F_II,0,
BACH2PUBLICUSE,,AMS16_1,1,8,1332,FOFC: H18p. Symptoms : Decrease in number of morning erection,X2446F_II,0,
BACH2PUBLICUSE,,AMS17_1,1,8,1333,FOFC: H18n. Symptoms : Decrease in sexual disire/libido,X2446F_II,0,
BACH2PUBLICUSE,,ANDRO,1,8,1115,"Androstenedione, ng/mL",,6,
BACH2PUBLICUSE,,ANEUR,1,8,850,FOID: E3r. Aortic aneurysm,X2511F_II,0,
BACH2PUBLICUSE,,ANEURAGE,1,8,99,FOID: E3rii. How old were you when you were first told,X2311F_II,0,
BACH2PUBLICUSE,,ANEURTX,1,8,98,FOID: E3ri. Have you ever or are you currently receiving treatment,X2501F_II,0,
BACH2PUBLICUSE,,ANGINA,1,8,841,FOID: E3i. Angina pectoris,X2511F_II,0,
BACH2PUBLICUSE,,ANGINA_1,1,8,1208,FOFB: E1z. Ever told you had: Angina pectoris,X2506F_II,0,
BACH2PUBLICUSE,,ANGNAAGE,1,8,81,FOID: E3iii. How old were you when you were first told,X2311F_II,0,
BACH2PUBLICUSE,,ANGNATX,1,8,80,FOID: E3ii. Have you ever or are you currently receiving treatment,X2501F_II,0,
BACH2PUBLICUSE,,ANTIDEP,1,8,24,FOIB: C2i. Anti-depression medication,X2506F_II,0,
BACH2PUBLICUSE,,ANTIDEP_1,1,8,673,FOFA: D2i. Anti-depression medication,X2506F_II,0,
BACH2PUBLICUSE,,ANXMED,1,8,23,FOIB: C2h. Medications for anxiety,X2506F_II,0,
BACH2PUBLICUSE,,ANXMED_1,1,8,672,FOFA: D2h. Medications for anxiety,X2506F_II,0,
BACH2PUBLICUSE,,ANYINS,1,8,898,FOIE: E11j. Any health insurance,X2506F_II,0,
BACH2PUBLICUSE,,ANYINS_1,1,8,1248,FOFB: E6i. Any health insurance,X2506F_II,0,
BACH2PUBLICUSE,,APO_A1_MGDL,1,8,1108,"Apolipoprotein AI, mg/dL",,7,
BACH2PUBLICUSE,,APO_B_MGDL,1,8,1107,"Apolipoprotein B, mg/dL",,7,
BACH2PUBLICUSE,,ARMCM00,1,8,279,FOSC: C2. Arm circumference,X2311F_II,0,
BACH2PUBLICUSE,,AROUSED4_1,1,8,1603,MSAQ/WSAQ: How often did you feel sexually aroused during sex? (lst 4 wks),X2367F_II,0,
BACH2PUBLICUSE,,ARRAGE,1,8,83,FOID: E3jii. How old were you when you were first told,X2311F_II,0,
BACH2PUBLICUSE,,ARRHYTH,1,8,842,FOID: E3j. An irregular heartbeat or arrhythmia,X2511F_II,0,
BACH2PUBLICUSE,,ARRHYTH_1,1,8,1209,FOFB: E1aa. Ever told you had: Irregular heartbeat,X2506F_II,0,
BACH2PUBLICUSE,,ARRTX,1,8,82,FOID: E3ji. Have you ever or are you currently receiving treatment,X2501F_II,0,
BACH2PUBLICUSE,,ARTHR,1,8,858,FOID: E3z. Arthritis or rheumatism,X2511F_II,0,
BACH2PUBLICUSE,,ARTHRAGE,1,8,115,FOID: E3zii. How old were you when you were first told,X2311F_II,0,
BACH2PUBLICUSE,,ARTHRTX,1,8,114,FOID: E3zi. Have you ever or are you currently receiving treatment,X2501F_II,0,
BACH2PUBLICUSE,,ARTHR_1,1,8,1195,FOFB: E1l. Ever told you had: Arthritis,X2506F_II,0,
BACH2PUBLICUSE,,ARTHR_TRT1A,1,8,1196,FOFB: E1l1. Ever told you had rheumatoid Arthritis,X2506F_II,0,
BACH2PUBLICUSE,,ARTHR_TRT1B,1,8,343,FOFB: E1l2. Regularly take medications for arthritis?,X2506F_II,0,
BACH2PUBLICUSE,,ASIAN,1,8,253,FOIG: L6b. Asian,X2506F_II,0,
BACH2PUBLICUSE,,ASIANC,1,8,9,INS1: C5b. Race: Asian,X2506F_II,0,
BACH2PUBLICUSE,,ASTHMA,1,8,836,FOID: E3d. Asthma,X2511F_II,0,
BACH2PUBLICUSE,,ASTHMAGE,1,8,71,FOID: E3dii. How old were you when you were first told,X2311F_II,0,
BACH2PUBLICUSE,,ASTHMATX,1,8,70,FOID: E3di. Have you ever or are you currently receiving treatment,X2501F_II,0,
BACH2PUBLICUSE,,ASTHMA_1,1,8,1182,FOFB: E1f. Ever told you had: Asthma,X2506F_II,0,
BACH2PUBLICUSE,,ASTHMA_TRT1,1,8,328,FOFB: E1f1. Ever told you had: Asthma: If yes do you take medication,X2456F_II,0,
BACH2PUBLICUSE,,AVGCIGAR,1,8,234,FOIF: J5b1. How many cigars do you smoke?,X2311F_II,0,
BACH2PUBLICUSE,,AVGCIGAR_1,1,8,481,"FOFC: I5b1. On average, how many cigars you smoke",X2311F_II,0,
BACH2PUBLICUSE,,AVGCIGS,1,8,232,FOIF: J3a1. on Average # cigarettes,X2311F_II,0,
BACH2PUBLICUSE,,AVGCIGS_1,1,8,479,"FOFC: I3a. On average, how many cigarettes you smoke",X2311F_II,0,
BACH2PUBLICUSE,,AVGNDRNK,1,8,239,"FOIF: J11. Now, how many drinks on average... those occasions?",X2311F_II,0,
BACH2PUBLICUSE,,AVGNDRNK_1,1,8,486,FOFC: I12. How many drinks on average do you have,X2311F_II,0,
BACH2PUBLICUSE,,AVGSLEEP,1,8,1058,FOIG: K17. How much do you usually sleep?,X2332F_II,0,
BACH2PUBLICUSE,,BACKLOW_M,1,8,638,PAIN: C47b. Back Lower: most pain,X2505F_II,0,
BACH2PUBLICUSE,,BACKLOW_S,1,8,637,PAIN: C47a. Back Lower: shaded pain,X2505F_II,0,
BACH2PUBLICUSE,,BACKUP_M,1,8,636,PAIN: C46b. Back Upper: most pain,X2505F_II,0,
BACH2PUBLICUSE,,BACKUP_S,1,8,635,PAIN: C46a. Back Upper: shaded pain,X2505F_II,0,
BACH2PUBLICUSE,,BANKLFT_M,1,8,658,PAIN: C57b. Back Ankle Left: most pain,X2505F_II,0,
BACH2PUBLICUSE,,BANKLFT_S,1,8,657,PAIN: C57a. Back Ankle Left: shaded pain,X2505F_II,0,
BACH2PUBLICUSE,,BANKRT_M,1,8,656,PAIN: C56b. Back Ankle Right: most pain,X2505F_II,0,
BACH2PUBLICUSE,,BANKRT_S,1,8,655,PAIN: C56a. Back Ankle Right: shaded pain,X2505F_II,0,
BACH2PUBLICUSE,,BARMLFT_M,1,8,618,PAIN: C37b. Back Arm Left: most pain,X2505F_II,0,
BACH2PUBLICUSE,,BARMLFT_S,1,8,617,PAIN: C37a. Back Arm Left: shaded pain,X2505F_II,0,
BACH2PUBLICUSE,,BARMRT_M,1,8,616,PAIN: C36b. Back Arm Right: most pain,X2505F_II,0,
BACH2PUBLICUSE,,BARMRT_S,1,8,615,PAIN: C36a. Back Arm Right: shaded pain,X2505F_II,0,
BACH2PUBLICUSE,,BARREVR,1,8,829,FOIC: D1c. Ever used some other barrier method,X2506F_II,0,
BACH2PUBLICUSE,,BARREVR_1,1,8,1268,FOFC: F1c. Have you and your partner ever used : other barrier method,X2506F_II,0,
BACH2PUBLICUSE,,BARRNOW,1,8,830,FOIC: D1ci. Are you or your partner currently using this method,X2506F_II,0,
BACH2PUBLICUSE,,BARRNOW_1,1,8,1269,FOFC: F1ci. If Yes: Are you and your partner currently using this method,X2506F_II,0,
BACH2PUBLICUSE,,BCIAGE,1,8,45,FOIC: D2bi. How old were you when you began using,X2311F_II,0,
BACH2PUBLICUSE,,BCIAGE_1,1,8,420,FOFC: F2bi. How old were you when you began using?,X2311F_II,0,
BACH2PUBLICUSE,,BCIDUR,1,8,46,FOIC: D2bii. For how long altogether have you used,X2311F_II,0,
BACH2PUBLICUSE,,BCIDUR_1,1,8,421,FOFC: F2bii. For how long altogether have you used,X2311F_II,0,
BACH2PUBLICUSE,,BCINOW,1,8,1636,FOIC: D2b. Injections for birth control,X2499F_II,0,
BACH2PUBLICUSE,,BCINOW_1,1,8,1695,FOFC: F2b. Ever used Birth Control Injections:If Yes: Is this Current?,X2503F_II,0,
BACH2PUBLICUSE,,BCIUNT,1,8,47,FOIC: D2biii. Units,X2431F_II,0,
BACH2PUBLICUSE,,BCIUNT_1,1,8,422,FOFC: F2biii. Units,X2431F_II,0,
BACH2PUBLICUSE,,BCMED,1,8,27,FOIB: C2l. Medications for endometriosis,X2506F_II,0,
BACH2PUBLICUSE,,BCMED_1,1,8,676,FOFA: D2l. Female: Medications for endometriosis,X2506F_II,0,
BACH2PUBLICUSE,,BCPAGE,1,8,42,FOIC: D2ai. How old were you when you began using,X2311F_II,0,
BACH2PUBLICUSE,,BCPAGE_1,1,8,417,FOFC: F2ai. How old were you when you began using?,X2311F_II,0,
BACH2PUBLICUSE,,BCPDUR,1,8,43,FOIC: D2aii. For how long altogether have you used,X2311F_II,0,
BACH2PUBLICUSE,,BCPDUR_1,1,8,418,FOFC: F2aii. For how long altogether have you used,X2311F_II,0,
BACH2PUBLICUSE,,BCPNOW,1,8,1635,FOIC: D2a. Birth control pills,X2499F_II,0,
BACH2PUBLICUSE,,BCPNOW_1,1,8,1694,FOFC: F2a. Ever used Birth Control Pills:If Yes: Is this Current?,X2503F_II,0,
BACH2PUBLICUSE,,BCPUNT,1,8,44,FOIC: D2aiii. Units,X2431F_II,0,
BACH2PUBLICUSE,,BCPUNT_1,1,8,419,FOFC: F2aiii. Units,X2431F_II,0,
BACH2PUBLICUSE,,BEATTHR2Y_1,1,8,804,MSAQ/WSAQ: How many times did this phys/thrt happen in the last 2 years (Batch 2-5),X2311F_II,0,
BACH2PUBLICUSE,,BEER30DY,1,8,960,FOIF: J9a. Beer or lite beer?,X2506F_II,0,
BACH2PUBLICUSE,,BEER30DY_1,1,8,1340,FOFC: I10a. In last 30 days : Beer / Lite Beer,X2506F_II,0,
BACH2PUBLICUSE,,BEERFREQ,1,8,961,"FOIF: J9ai. If yes, about how often do you drink?",X2328F_II,0,
BACH2PUBLICUSE,,BEERFREQ_1,1,8,1341,FOFC: I10ai. How often do you drink : Beer / Lite Beer,X2392F_II,0,
BACH2PUBLICUSE,,BEERMEAL_1,1,8,494,FOFC: I10aiii. Meal with : Beer / Lite Beer,X2420F_II,0,
BACH2PUBLICUSE,,BEERVOL,1,8,962,"FOIF: J9aii. If yes, how much do you drink on a typical day?",X2322F_II,0,
BACH2PUBLICUSE,,BEERVOL_1,1,8,1342,FOFC: I10aii. How much do you drink : Beer / Lite Beer,X2343F_II,0,
BACH2PUBLICUSE,,BELBLFT_M,1,8,622,PAIN: C39b. Back Elbow Left: most pain,X2505F_II,0,
BACH2PUBLICUSE,,BELBLFT_S,1,8,621,PAIN: C39a. Back Elbow Left: shaded pain,X2505F_II,0,
BACH2PUBLICUSE,,BELBRT_M,1,8,620,PAIN: C38b. Back Elbow Right: most pain,X2505F_II,0,
BACH2PUBLICUSE,,BELBRT_S,1,8,619,PAIN: C38a. Back Elbow Right: shaded pain,X2505F_II,0,
BACH2PUBLICUSE,,BENDINP_1,1,8,1578,MSAQ: 18. Have you had abnormal bend/curvature in your penis,X2506F_II,0,
BACH2PUBLICUSE,,BFARMLFT_M,1,8,626,PAIN: C41b. Back Forearm Left: most pain,X2505F_II,0,
BACH2PUBLICUSE,,BFARMLFT_S,1,8,625,PAIN: C41a. Back Forearm Left: shaded pain,X2505F_II,0,
BACH2PUBLICUSE,,BFARMRT_M,1,8,624,PAIN: C40b. Back Forearm Right: most pain,X2505F_II,0,
BACH2PUBLICUSE,,BFARMRT_S,1,8,623,PAIN: C40a. Back Forearm Right: shaded pain,X2505F_II,0,
BACH2PUBLICUSE,,BFOOTLFT_M,1,8,662,PAIN: C59b. Back Foot Left: most pain,X2505F_II,0,
BACH2PUBLICUSE,,BFOOTLFT_S,1,8,661,PAIN: C59a. Back Foot Left: shaded pain,X2505F_II,0,
BACH2PUBLICUSE,,BFOOTRT_M,1,8,660,PAIN: C58b. Back Foot Right: most pain,X2505F_II,0,
BACH2PUBLICUSE,,BFOOTRT_S,1,8,659,PAIN: C58a. Back Foot Right: shaded pain,X2505F_II,0,
BACH2PUBLICUSE,,BHNDLFT_M,1,8,634,PAIN: C45b. Back Hand Left: most pain,X2505F_II,0,
BACH2PUBLICUSE,,BHNDLFT_S,1,8,633,PAIN: C45a. Back Hand Left: shaded pain,X2505F_II,0,
BACH2PUBLICUSE,,BHNDRT_M,1,8,632,PAIN: C44b. Back Hand Right: most pain,X2505F_II,0,
BACH2PUBLICUSE,,BHNDRT_S,1,8,631,PAIN: C44a. Back Hand Right: shaded pain,X2505F_II,0,
BACH2PUBLICUSE,,BIOVARY,1,8,223,FOIF: G3b1. Were one or two ovaries removed?,X2458F_II,0,
BACH2PUBLICUSE,,BKNELFT_M,1,8,650,PAIN: C53b. Back Knee Left: most pain,X2505F_II,0,
BACH2PUBLICUSE,,BKNELFT_S,1,8,649,PAIN: C53a. Back Knee Left: shaded pain,X2505F_II,0,
BACH2PUBLICUSE,,BKNERT_M,1,8,648,PAIN: C52b. Back Knee Right: most pain,X2505F_II,0,
BACH2PUBLICUSE,,BKNERT_S,1,8,647,PAIN: C52a. Back Knee Right: shaded pain,X2505F_II,0,
BACH2PUBLICUSE,,BLACK,1,8,254,FOIG: L6c. Black or African American,X2506F_II,0,
BACH2PUBLICUSE,,BLACKC,1,8,10,INS1: C5c. Race: Black or African American,X2506F_II,0,
BACH2PUBLICUSE,,BLADCONOW_1,1,8,1539,FOFD: J19. My bladder condition,X2387F_II,0,
BACH2PUBLICUSE,,BLADMENAGE_1,1,8,435,FOFC: G1ci. How old were you at the time of surgery:Age,X2311F_II,0,
BACH2PUBLICUSE,,BLADMEN_1,1,8,1275,FOFC: G1c. Have you seen HealthCare Provider For: Bladder Surgery,X2506F_II,0,
BACH2PUBLICUSE,,BLADSURAGE_1,1,8,459,FOFC: G5di. How old were you at the time of surgery:Age,X2311F_II,0,
BACH2PUBLICUSE,,BLADSURG,1,8,1653,FOIF: G3d. Bladder surgery,X2506F_II,0,
BACH2PUBLICUSE,,BLADSURG_1,1,8,1703,FOFC: G5d. Have you ever had: A Bladder Surgery,X2497F_II,0,
BACH2PUBLICUSE,,BLDTHIN,1,8,16,FOIB: C2a. Any medication to thin your blood,X2506F_II,0,
BACH2PUBLICUSE,,BLDTHIN_1,1,8,665,FOFA: D2a. Any medications to thin your blood,X2506F_II,0,
BACH2PUBLICUSE,,BLDU4_1,1,8,1464,FOFD: J1tiii. Past 4 weeks problem for you: blood in urine,X2441F_II,0,
BACH2PUBLICUSE,,BLDUDUR,1,8,1014,FOIG: K1sii. How long?,X2325F_II,0,
BACH2PUBLICUSE,,BLDUDUR_1,1,8,1463,FOFD: J1tii. How long have you had this experience: blood in urine,X2351F_II,0,
BACH2PUBLICUSE,,BLDUFRQ,1,8,1013,FOIG: K1si. Visible blood in your urine?,X2330F_II,0,
BACH2PUBLICUSE,,BLDUFRQ_1,1,8,1462,FOFD: J1ti. Would you say: blood in urine,X2406F_II,0,
BACH2PUBLICUSE,,BLDUHEP_1,1,8,1465,FOFD: J1tiv. Seen a healthcare provider for this symptom: blood in urine,X2506F_II,0,
BACH2PUBLICUSE,,BLDUTRT_1,1,8,1466,FOFD: J1tv. IF YES: Did you receive treatment: blood in urine,X2465F_II,0,
BACH2PUBLICUSE,,BLEGLFT_M,1,8,654,PAIN: C55b. Back Lower Leg Left: most pain,X2505F_II,0,
BACH2PUBLICUSE,,BLEGLFT_S,1,8,653,PAIN: C55a. Back Lower Leg Left: shaded pain,X2505F_II,0,
BACH2PUBLICUSE,,BLEGRT_M,1,8,652,PAIN: C54b. Back Lower Leg Right: most pain,X2505F_II,0,
BACH2PUBLICUSE,,BLEGRT_S,1,8,651,PAIN: C54a. Back Lower Leg Right: shaded pain,X2505F_II,0,
BACH2PUBLICUSE,,BNECK_M,1,8,610,PAIN: C33b. Back Neck: most pain,X2505F_II,0,
BACH2PUBLICUSE,,BNECK_S,1,8,609,PAIN: C33a. Back Neck: shaded pain,X2505F_II,0,
BACH2PUBLICUSE,,BNGE30DY,1,8,238,"FOIF: J10. Considering, how many times during the last 30 days?",X2311F_II,0,
BACH2PUBLICUSE,,BNGE30DY_1,1,8,485,FOFC: I11. How many times you had 5 or more drinks within 24 hours,X2311F_II,0,
BACH2PUBLICUSE,,BORNUS,1,8,1061,FOIG: L2. Were you born in the United States?,X2506F_II,0,
BACH2PUBLICUSE,,BOSSY,1,8,1060,FOIG: K19. Do you like directing other people's work?,X2506F_II,0,
BACH2PUBLICUSE,,BPHAGE_1,1,8,394,FOFB: E2ai. Ever told you had: Benign Prostatic Hyperplasia: Age,X2311F_II,0,
BACH2PUBLICUSE,,BPH_1,1,8,1227,FOFB: E2a. Ever told you had: Benign Prostatic Hyperplasia,X2506F_II,0,
BACH2PUBLICUSE,,BPMED,1,8,20,FOIB: C2e. Blood pressure or fluid pills,X2506F_II,0,
BACH2PUBLICUSE,,BPMED_1,1,8,669,FOFA: D2e. Blood pressure or fluid pills,X2506F_II,0,
BACH2PUBLICUSE,,BSHLFT_M,1,8,614,PAIN: C35b. Back Shoulder Left: most pain,X2505F_II,0,
BACH2PUBLICUSE,,BSHLFT_S,1,8,613,PAIN: C35a. Back Shoulder Left: shaded pain,X2505F_II,0,
BACH2PUBLICUSE,,BSHRT_M,1,8,612,PAIN: C34b. Back Shoulder Right: most pain,X2505F_II,0,
BACH2PUBLICUSE,,BSHRT_S,1,8,611,PAIN: C34a. Back Shoulder Right: shaded pain,X2505F_II,0,
BACH2PUBLICUSE,,BTHILFT_M,1,8,646,PAIN: C51b. Back Thigh Left: most pain,X2505F_II,0,
BACH2PUBLICUSE,,BTHILFT_S,1,8,645,PAIN: C51a. Back Thigh Left: shaded pain,X2505F_II,0,
BACH2PUBLICUSE,,BTHIRT_M,1,8,644,PAIN: C50b. Back Thigh Right: most pain,X2505F_II,0,
BACH2PUBLICUSE,,BTHIRT_S,1,8,643,PAIN: C50a. Back Thigh Right: shaded pain,X2505F_II,0,
BACH2PUBLICUSE,,BUTTLFT_M,1,8,642,PAIN: C49b. Buttock Left: most pain,X2505F_II,0,
BACH2PUBLICUSE,,BUTTLFT_S,1,8,641,PAIN: C49a. Buttock Left: shaded pain,X2505F_II,0,
BACH2PUBLICUSE,,BUTTRT_M,1,8,640,PAIN: C48b. Buttock Right: most pain,X2505F_II,0,
BACH2PUBLICUSE,,BUTTRT_S,1,8,639,PAIN: C48a. Buttock Right: shaded pain,X2505F_II,0,
BACH2PUBLICUSE,,BWGRAMS_1,1,8,469,FOFC: G6fiii. What is the birth weight of the baby: grams,X2311F_II,0,
BACH2PUBLICUSE,,BWLBS_1,1,8,467,FOFC: G6fi. What is the birth weight of the baby: pounds,X2311F_II,0,
BACH2PUBLICUSE,,BWOZS_1,1,8,468,FOFC: G6fii. What is the birth weight of the baby: ounces,X2311F_II,0,
BACH2PUBLICUSE,,BWRSTLFT_M,1,8,630,PAIN: C43b. Back Wrist Left: most pain,X2505F_II,0,
BACH2PUBLICUSE,,BWRSTLFT_S,1,8,629,PAIN: C43a. Back Wrist Left: shaded pain,X2505F_II,0,
BACH2PUBLICUSE,,BWRSTRT_M,1,8,628,PAIN: C42b. Back Wrist Right: most pain,X2505F_II,0,
BACH2PUBLICUSE,,BWRSTRT_S,1,8,627,PAIN: C42a. Back Wrist Right: shaded pain,X2505F_II,0,
BACH2PUBLICUSE,,CABG,1,8,839,FOID: E3g. Coronary artery bypass or angioplasty,X2511F_II,0,
BACH2PUBLICUSE,,CABGAGE,1,8,77,FOID: E3gii. How old were you when you were first told,X2311F_II,0,
BACH2PUBLICUSE,,CABGTX,1,8,76,FOID: E3gi. Have you ever or are you currently receiving treatment,X2501F_II,0,
BACH2PUBLICUSE,,CABG_1,1,8,1207,FOFB: E1y. Ever told you had: Coronary artery bypass,X2506F_II,0,
BACH2PUBLICUSE,,CANC1AGE,1,8,123,FOID: E3ddii. How old were you when you were first told,X2311F_II,0,
BACH2PUBLICUSE,,CANC1AGEA_1,1,8,350,FOFB: E1s1i. Ever told you had: Cancer: Age,X2311F_II,0,
BACH2PUBLICUSE,,CANC1AGEB_1,1,8,352,FOFB: E1s2i. Ever told you had:  Cancer spread Age,X2311F_II,0,
BACH2PUBLICUSE,,CANC1TRT_1,1,8,351,FOFB: E1s2. Ever told you had: Cancer spread?,X2506F_II,0,
BACH2PUBLICUSE,,CANC1TX,1,8,122,FOID: E3ddi. Have you ever or are you currently receiving treatment,X2501F_II,0,
BACH2PUBLICUSE,,CANC2AGE,1,8,126,FOID: E3eeii. How old were you when you were first told,X2311F_II,0,
BACH2PUBLICUSE,,CANC2AGEA_1,1,8,354,FOFB: E1t1i. Ever told you had:  Other Cancer Age,X2311F_II,0,
BACH2PUBLICUSE,,CANC2AGEB_1,1,8,356,FOFB: E1t2i. Ever told you had:  Cancer spread Age,X2311F_II,0,
BACH2PUBLICUSE,,CANC2MET_1,1,8,355,FOFB: E1t2. Ever told you had: Other Cancer spread?,X2506F_II,0,
BACH2PUBLICUSE,,CANC2TX,1,8,125,FOID: E3eei. Have you ever or are you currently receiving treatment,X2501F_II,0,
BACH2PUBLICUSE,,CANC3AGE,1,8,129,FOID: E3ffii. How old were you when you were first told,X2311F_II,0,
