MEMNAME,MEMLABEL,NAME,TYPE,LENGTH,VARNUM,LABEL,FORMAT,FORMATL,INFORMAT
BACH2PUBLICUSE,,PBLADTRT_1,1,8,1456,FOFD: J1rv. IF YES: Did you receive treatment: pain bladder,X2465F_II,0,
BACH2PUBLICUSE,,PBLATX,1,8,144,FOID: E3nni. Have you ever or are you currently receiving treatment,X2501F_II,0,
BACH2PUBLICUSE,,PBSAGE_1,1,8,391,FOFB: E2gi. Ever told you had: painful bladder syndrome: Age,X2311F_II,0,
BACH2PUBLICUSE,,PBS_1,1,8,1225,FOFB: E2g. Ever told you had: painful bladder syndrome,X2506F_II,0,
BACH2PUBLICUSE,,PCOS,1,8,1645,FOID: E3kk. Polycystic ovarian syndrome,X2511F_II,0,
BACH2PUBLICUSE,,PCOSAGE,1,8,139,FOID: E3kkii. How old were you when you were first told,X2311F_II,0,
BACH2PUBLICUSE,,PCOSAGE_1,1,8,384,FOFB: E1vvi. Ever told you had: polcystic ovarian syndrome: Age,X2311F_II,0,
BACH2PUBLICUSE,,PCOSTX,1,8,138,FOID: E3kki. Have you ever or are you currently receiving treatment,X2501F_II,0,
BACH2PUBLICUSE,,PCOS_1,1,8,1688,FOFB: E1vv. Ever told you had: Polycystic ovarian syndrome,X2506F_II,0,
BACH2PUBLICUSE,,PENLOOKS_1,1,8,1580,MSAQ: 20. Do you have problem the way your penis looks,X2439F_II,0,
BACH2PUBLICUSE,,PERIP4_1,1,8,1424,FOFD: J1liii. Past 4 weeks problem for you: pain in perineum,X2441F_II,0,
BACH2PUBLICUSE,,PERIPDUR,1,8,1000,FOIG: K1lii. How long?,X2325F_II,0,
BACH2PUBLICUSE,,PERIPDUR_1,1,8,1423,FOFD: J1lii. How long have you had this experience: pain in perineum,X2351F_II,0,
BACH2PUBLICUSE,,PERIPFRQ,1,8,999,FOIG: K1li. If Male Pain discomfort in area btw recturm and testicles,X2330F_II,0,
BACH2PUBLICUSE,,PERIPFRQ_1,1,8,1422,FOFD: J1li. Would you say: pain in perineum,X2406F_II,0,
BACH2PUBLICUSE,,PERIPHEP_1,1,8,1425,FOFD: J1liv. Seen provider for this symptom: pain in perineum,X2506F_II,0,
BACH2PUBLICUSE,,PERIPTRT_1,1,8,1426,FOFD: J1lv. IF YES: Did you receive treatment: pain in perineum,X2465F_II,0,
BACH2PUBLICUSE,,PERMCATH,1,8,146,FOIE: E4b1. Was it an in-dwelling or permanent catheter,X2506F_II,0,
BACH2PUBLICUSE,,PERMCTH_1,1,8,398,FOFB: E3b1. Ever told you had: in dwelling or permanent catheter,X2506F_II,0,
BACH2PUBLICUSE,,PEYDNOSX_1,1,8,1581,MSAQ: 21. Does your peyronies disease make it difficult to have sex,X2506F_II,0,
BACH2PUBLICUSE,,PEYRONIED_1,1,8,1579,MSAQ: 19. Have you been told you have peyronies disease,X2506F_II,0,
BACH2PUBLICUSE,,PFDSURAGE_1,1,8,460,FOFC: G5ei. How old were you at the time of surgery:Age,X2311F_II,0,
BACH2PUBLICUSE,,PFDSURG,1,8,1654,FOIF: G3e. Surgery for repair of a pelvic prolapse,X2506F_II,0,
BACH2PUBLICUSE,,PFDSURG_1,1,8,1704,FOFC: G5e. Have you ever had: A Surgery for repair of pelvic prolapse,X2497F_II,0,
BACH2PUBLICUSE,,PFILL4_1,1,8,1469,FOFD: J1uiii. Past 4 weeks  problem for you: pain bladder fills,X2441F_II,0,
BACH2PUBLICUSE,,PFILLDUR,1,8,1016,FOIG: K1tii. How long?,X2325F_II,0,
BACH2PUBLICUSE,,PFILLDUR_1,1,8,1468,FOFD: J1uii. How long have you had this experience: pain bladder fills,X2351F_II,0,
BACH2PUBLICUSE,,PFILLFRQ,1,8,1015,FOIG: K1ti. Pain increasing when your bladder fills?,X2330F_II,0,
BACH2PUBLICUSE,,PFILLFRQ_1,1,8,1467,FOFD: J1ui. Would you say: pain bladder fills,X2406F_II,0,
BACH2PUBLICUSE,,PFILLHEP_1,1,8,1470,FOFD: J1uiv. Seen provider for this symptom: pain bladder fills,X2506F_II,0,
BACH2PUBLICUSE,,PFILLTRT_1,1,8,1471,FOFD: J1uv. IF YES: Did you receive treatment: pain bladder fills,X2465F_II,0,
BACH2PUBLICUSE,,PHYSWORK,1,8,927,FOIE: F5b. Which describes the amount of physical activity at your job,X2427F_II,0,
BACH2PUBLICUSE,,PHYSWORK_1,1,8,1163,FOFA: D5b. Which describes amount of physical activity,X2426F_II,0,
BACH2PUBLICUSE,,PID,1,8,1643,FOID: E3.ii. Pelvic inflammatory disease,X2511F_II,0,
BACH2PUBLICUSE,,PIDAGE,1,8,135,FOID: E3.iiii. How old were you when you were first told,X2311F_II,0,
BACH2PUBLICUSE,,PIDAGE_1,1,8,382,FOFB: E1tti. Ever told you had: Pelvic Inflamatory Disease: Age,X2311F_II,0,
BACH2PUBLICUSE,,PIDTX,1,8,134,FOID: E3.iii. Have you ever or are you currently receiving treatment,X2501F_II,0,
BACH2PUBLICUSE,,PID_1,1,8,1686,FOFB: E1tt. Ever told you had: Pelvic Inflamatory Disease,X2506F_II,0,
BACH2PUBLICUSE,,PLUMEMB_1,1,8,1212,FOFB: E1dd. Ever told you had: Pulmonary embolus,X2506F_II,0,
BACH2PUBLICUSE,,PMR_1,1,8,1198,FOFB: E1n. Ever told you had: Polymyalgia rheumatica,X2506F_II,0,
BACH2PUBLICUSE,,PMSOTC,1,8,37,FOIC: C3d. Anything for PMS,X2506F_II,0,
BACH2PUBLICUSE,,PMSOTC_1,1,8,687,FOFA: D3f. Last four weeks: Anything for PMS,X2506F_II,0,
BACH2PUBLICUSE,,PNPLURPB,1,8,1077,FOSM: PM4c. I have pelvic or urinary problem that interferes with sex,X2506F_II,0,
BACH2PUBLICUSE,,PNPLURPB_1,1,8,1563,MSAQ: 7c. No sex activities: pelvic or urinary problem,X2506F_II,0,
BACH2PUBLICUSE,,PNPLVAUR,1,8,1668,FOSW: PF4c. Pelvic or vaginal pain or a urinary problem that interferes,X2506F_II,0,
BACH2PUBLICUSE,,PNPLVAUR_1,1,8,1732,"WSAQ: 7C. No sex activities: pelvic, vaginal or urinary problem",X2506F_II,0,
BACH2PUBLICUSE,,POSTP4_1,1,8,1384,FOFD: J1diii. Past 4 weeks problem for you: postponing,X2441F_II,0,
BACH2PUBLICUSE,,POSTPDUR,1,8,984,FOIG: K1dii. How long,X2325F_II,0,
BACH2PUBLICUSE,,POSTPDUR_1,1,8,1383,FOFD: J1dii. How long have you had this experience: postponing,X2351F_II,0,
BACH2PUBLICUSE,,POSTPFRQ,1,8,983,FOIG: K1di. Difficulty postponing urination?,X2330F_II,0,
BACH2PUBLICUSE,,POSTPFRQ_1,1,8,1382,FOFD: J1di. Would you say: postponing,X2406F_II,0,
BACH2PUBLICUSE,,POSTPHEP_1,1,8,1385,FOFD: J1div. Seen a provider for this symptom: postponing,X2506F_II,0,
BACH2PUBLICUSE,,POSTPTRT_1,1,8,1386,FOFD: J1dv. IF YES: Did you receive treatment: postponing,X2465F_II,0,
BACH2PUBLICUSE,,POSTU4_1,1,8,1409,FOFD: J1iiii. Past 4 weeks problem for you: leakage immediately,X2441F_II,0,
BACH2PUBLICUSE,,POSTUDUR_1,1,8,1408,FOFD: J1iii. How long have you had this experience: leakage immediately,X2351F_II,0,
BACH2PUBLICUSE,,POSTUFRQ_1,1,8,1407,FOFD: J1ii. Would you say: leakage immediately,X2406F_II,0,
BACH2PUBLICUSE,,POSTUHEP_1,1,8,1410,FOFD: J1iiv. Seen a healthcare provider for this symptom: leakage immedia,X2506F_II,0,
BACH2PUBLICUSE,,POSTUTRT_1,1,8,1411,FOFD: J1iv. IF YES: Did you receive treatment: leakage immediately,X2465F_II,0,
BACH2PUBLICUSE,,PPAFTPER_1,1,8,499,FOFC: G11bii. Pelvic Pain with monthly cycle after period,X2506F_II,0,
BACH2PUBLICUSE,,PPBEFPER_1,1,8,504,FOFC: G11bi. Pelvic Pain with monthly cycle before period,X2506F_II,0,
BACH2PUBLICUSE,,PPBLAD,1,8,226,FOIF: G8c. Is this pain in the area of your bladder?,X2506F_II,0,
BACH2PUBLICUSE,,PPBLAD_1,1,8,474,FOFC: G11c. Last 12 months:Is this pain in the area of the bladder,X2506F_II,0,
BACH2PUBLICUSE,,PPCYCLE,1,8,225,"FOIF: G8b. In the last 12 monhts, have you had this pain always?",X2502F_II,0,
BACH2PUBLICUSE,,PPCYCLE_1,1,8,473,FOFC: G11b. Last 12 months:pelvic pain about same time of  monthly cycle,X2504F_II,0,
BACH2PUBLICUSE,,PPDAYS,1,8,227,"FOIF: G10. On average, how many days of pelvic pain do you have?",X2320F_II,0,
BACH2PUBLICUSE,,PPDAYS_1,1,8,475,FOFC: G14. On average how many days in a month you have pelvic pain,X2345F_II,0,
BACH2PUBLICUSE,,PPDUR,1,8,228,FOIF: G11. For how long have you been experiencing pelvic pain?,X2417F_II,0,
BACH2PUBLICUSE,,PPDURPER_1,1,8,492,FOFC: G11biv. Pelvic Pain with monthly cycle during period,X2506F_II,0,
BACH2PUBLICUSE,,PPDUR_1,1,8,476,FOFC: G15. How long have you been experiencing pelvic pain,X2418F_II,0,
BACH2PUBLICUSE,,PPINT,1,8,1663,FOIF: G9a. pelvic pain during or in the 24 hours after sex?,X2506F_II,0,
BACH2PUBLICUSE,,PPINTERF,1,8,229,FOIF: G12. To what extend does this pain prevent you from doing things?,X2453F_II,0,
BACH2PUBLICUSE,,PPINTERF_1,1,8,477,FOFC: G16. What extent pelvic pain prevent you from doing things,X2452F_II,0,
BACH2PUBLICUSE,,PPINT_1,1,8,1285,FOFC: G13a. Pelvic pain during or in 24 hours after sexual intercourse,X2508F_II,0,
BACH2PUBLICUSE,,PPMED,1,8,28,FOIB: C2m. Medications for pelvic pain,X2506F_II,0,
BACH2PUBLICUSE,,PPMED_1,1,8,677,FOFA: D2m. Medications for pelvic pain,X2506F_II,0,
BACH2PUBLICUSE,,PPMIDPER_1,1,8,512,FOFC: G11biii. Pelvic Pain with monthly cycle mid cycle,X2506F_II,0,
BACH2PUBLICUSE,,PPNOTREG_1,1,8,498,FOFC: G11bv. Pelvic Pain with monthly cycle not at same time in cycle,X2506F_II,0,
BACH2PUBLICUSE,,PPOTH,1,8,1664,FOIF: G9b. Pelvic pain NOT with periods or intercourse?,X2506F_II,0,
BACH2PUBLICUSE,,PPOTHM_1,1,8,1286,FOFC: G13c. Pelvic pain not with intercourse,X2508F_II,0,
BACH2PUBLICUSE,,PPOTHW_1,1,8,1720,FOFC: G13b. Pelvic pain not with periods or intercourse,X2508F_II,0,
BACH2PUBLICUSE,,PPPROB_1,1,8,478,FOFC: G17. Last 4 weeks: How much has this been a problem,X2455F_II,0,
BACH2PUBLICUSE,,PRE12MON2_1,1,8,456,FOFC: G5b2a. Did you have menstrual period in 12 months prior to surgery,X2506F_II,0,
BACH2PUBLICUSE,,PRE12MON_1,1,8,444,FOFC: G5a2a. Did you have menstrual period in 12 months prior to surgery,X2506F_II,0,
BACH2PUBLICUSE,,PRE3MON2_1,1,8,455,FOFC: G5b2. Did you have menstrual period in 3 months prior to surgery,X2506F_II,0,
BACH2PUBLICUSE,,PRE3MON_1,1,8,443,FOFC: G5a2. Did you have menstrual period in 3 months prior to surgery,X2506F_II,0,
BACH2PUBLICUSE,,PRECT4_1,1,8,1484,FOFD: J1xiii. Past 4 weeks problem for you: pain rectum,X2441F_II,0,
BACH2PUBLICUSE,,PRECTDUR,1,8,1022,FOIG: K1wii. How long?,X2325F_II,0,
BACH2PUBLICUSE,,PRECTDUR_1,1,8,1483,FOFD: J1xii. How long have you had this experience: pain rectum,X2351F_II,0,
BACH2PUBLICUSE,,PRECTFRQ,1,8,1021,FOIG: K1wi. Pain or discomfort in your rectum?,X2330F_II,0,
BACH2PUBLICUSE,,PRECTFRQ_1,1,8,1482,FOFD: J1xi. Would you say: pain rectum,X2406F_II,0,
BACH2PUBLICUSE,,PRECTHEP_1,1,8,1485,FOFD: J1xiv. Seen provider for this symptom: pain rectum,X2506F_II,0,
BACH2PUBLICUSE,,PRECTTRT_1,1,8,1486,FOFD: J1xv. IF YES: Did you receive treatment: pain rectum,X2465F_II,0,
BACH2PUBLICUSE,,PRECTUMAGE_1,1,8,388,FOFB: E1zz1. Ever told you had: prolapsed rectum: Age,X2311F_II,0,
BACH2PUBLICUSE,,PREECARE,1,8,895,FOIE: E11g. Free care at a particular clinic or hospital,X2506F_II,0,
BACH2PUBLICUSE,,PREECARE_1,1,8,1246,FOFB: E6h. Health Insurance: Free care at a particular hospital,X2506F_II,0,
BACH2PUBLICUSE,,PRICAN,1,8,243,FOIG: L4b. Puerto Rican - updated elsewhere,X2506F_II,0,
BACH2PUBLICUSE,,PRIVINS,1,8,889,FOIE: E11a. Private insurance from your or your partner's employer,X2506F_II,0,
BACH2PUBLICUSE,,PRIVINS_1,1,8,1240,FOFB: E6a. Health Insurance: Private insurance,X2506F_II,0,
BACH2PUBLICUSE,,PRNOINTRST_1,1,8,1566,MSAQ/WSAQ: No sex activities: partner no interest,X2506F_II,0,
BACH2PUBLICUSE,,PROLACTIN,1,8,1109,"Prolactin, uIU/mL",,8,
BACH2PUBLICUSE,,PROSAGE,1,8,220,"FOIF: G1ci. If yes, what age?",X2311F_II,0,
BACH2PUBLICUSE,,PROSAGE_1,1,8,436,FOFC: G1di. How old were you at the time of surgery:Age,X2311F_II,0,
BACH2PUBLICUSE,,PROSSURG,1,8,931,FOIF: G1c. Bladder or prostate surgery,X2506F_II,0,
BACH2PUBLICUSE,,PROSSURG_1,1,8,1276,FOFC: G1d. Have you seen HealthCare Provider For: Prostate Surgery,X2506F_II,0,
BACH2PUBLICUSE,,PROSTATAGE_1,1,8,395,FOFB: E2bi. Ever told you had: Prostatitis: Age,X2311F_II,0,
BACH2PUBLICUSE,,PROSTAT_1,1,8,1228,FOFB: E2b. Ever told you had: Prostatitis,X2506F_II,0,
BACH2PUBLICUSE,,PRTHLTPB,1,8,1079,FOSM: PM4e. My partner has a health problem that interferes with sex,X2506F_II,0,
BACH2PUBLICUSE,,PRTHLTPB_1,1,8,1565,MSAQ/WSAQ: No sex activities: partner has health problem,X2506F_II,0,
BACH2PUBLICUSE,,PT4SDSIN,1,8,1073,FOSM: PM2. How would you rate your level of sexual desire or interest,X2488F_II,0,
BACH2PUBLICUSE,,PULMAGE,1,8,97,FOID: E3qii. How old were you when you were first told,X2311F_II,0,
BACH2PUBLICUSE,,PULMEMB,1,8,849,FOID: E3q. Pulmonary embolus,X2511F_II,0,
BACH2PUBLICUSE,,PULMEMBAGE_1,1,8,369,FOFB: E1ddi. Ever told you had: Pulmonary embolus : Age,X2311F_II,0,
BACH2PUBLICUSE,,PULMTX,1,8,96,FOID: E3qi. Have you ever or are you currently receiving treatment,X2501F_II,0,
BACH2PUBLICUSE,,PULSE001,1,8,278,FOSC: C1. First pulse,X2311F_II,0,
BACH2PUBLICUSE,,PULSE002,1,8,280,FOSC: C6. Second pulse,X2311F_II,0,
BACH2PUBLICUSE,,PURET4_1,1,8,1459,FOFD: J1siii. Past 4 weeks problem for you: pain urethra,X2441F_II,0,
BACH2PUBLICUSE,,PURETDUR,1,8,1012,FOIG: K1rii. How long?,X2325F_II,0,
BACH2PUBLICUSE,,PURETDUR_1,1,8,1458,FOFD: J1sii. How long have you had this experience: pain urethra,X2351F_II,0,
BACH2PUBLICUSE,,PURETFRQ,1,8,1011,FOIG: K1ri. Pain or discomfort in your urethra?,X2330F_II,0,
BACH2PUBLICUSE,,PURETFRQ_1,1,8,1457,FOFD: J1si. Would you say: pain urethra,X2406F_II,0,
BACH2PUBLICUSE,,PURETHEP_1,1,8,1460,FOFD: J1siv. Seen provider for this symptom: pain urethra,X2506F_II,0,
BACH2PUBLICUSE,,PURETTRT_1,1,8,1461,FOFD: J1sv. IF YES: Did you receive treatment: pain urethra,X2465F_II,0,
BACH2PUBLICUSE,,PURIN4_1,1,8,1474,FOFD: J1viii. Past 4 weeks problem for you: pain relieved,X2441F_II,0,
BACH2PUBLICUSE,,PURINDUR,1,8,1018,FOIG: K1uii. How long?,X2325F_II,0,
BACH2PUBLICUSE,,PURINDUR_1,1,8,1473,FOFD: J1vii. How long have you had this experience: pain relieved,X2351F_II,0,
BACH2PUBLICUSE,,PURINFRQ,1,8,1017,FOIG: K1ui. Pain relieved by urination?,X2330F_II,0,
BACH2PUBLICUSE,,PURINFRQ_1,1,8,1472,FOFD: J1vi. Would you say: pain relieved,X2406F_II,0,
BACH2PUBLICUSE,,PURINHEP_1,1,8,1475,FOFD: J1viv. Seen a provider for this symptom: pain relieved,X2506F_II,0,
BACH2PUBLICUSE,,PURINTRT_1,1,8,1476,FOFD: J1vv. IF YES: Did you receive treatment: pain relieved,X2465F_II,0,
BACH2PUBLICUSE,,PUSH4_1,1,8,1394,FOFD: J1fiii. Past 4 weeks problem for you: push or strain,X2441F_II,0,
BACH2PUBLICUSE,,PUSHDUR,1,8,988,FOIG: K1fii. How long,X2325F_II,0,
BACH2PUBLICUSE,,PUSHDUR_1,1,8,1393,FOFD: J1fii. How long have you had this experience: push or strain,X2351F_II,0,
BACH2PUBLICUSE,,PUSHFRQ,1,8,987,FOIG: K1fi. To push or strain to begin urination?,X2330F_II,0,
BACH2PUBLICUSE,,PUSHFRQ_1,1,8,1392,FOFD: J1fi. Would you say: push or strain,X2406F_II,0,
BACH2PUBLICUSE,,PUSHHEP_1,1,8,1395,FOFD: J1fiv. Seen provider for this symptom: push or strain,X2506F_II,0,
BACH2PUBLICUSE,,PUSHTRT_1,1,8,1396,FOFD: J1fv. IF YES: Did you receive treatment,X2465F_II,0,
BACH2PUBLICUSE,,PUTEAGE,1,8,143,FOID: E3mmii. How old were you when you were first told,X2311F_II,0,
BACH2PUBLICUSE,,PUTERUS,1,8,1647,FOID: E3mm. Prolapsed uterus,X2511F_II,0,
BACH2PUBLICUSE,,PUTERUSAGE_1,1,8,386,FOFB: E1xxi. Ever told you had: prolapsed uterus: Age,X2311F_II,0,
BACH2PUBLICUSE,,PUTERUS_1,1,8,1690,FOFB: E1xx. Ever told you had: prolapsed uterus,X2506F_II,0,
BACH2PUBLICUSE,,PUTETX,1,8,142,FOID: E3mmi. Have you ever or are you currently receiving treatment,X2501F_II,0,
BACH2PUBLICUSE,,PVAG4_1,1,8,1727,FOFD: J1yiii. Past 4 weeks problem for you: pain vagina,X2441F_II,0,
BACH2PUBLICUSE,,PVAGDUR,1,8,1666,FOIG: K1xii. How long?,X2325F_II,0,
BACH2PUBLICUSE,,PVAGDUR_1,1,8,1726,FOFD: J1yii. How long have you had this experience: pain vagina,X2351F_II,0,
BACH2PUBLICUSE,,PVAGFRQ,1,8,1665,FOIG: K1xi. If Female:Pain or discomfort at the entrance of vagina?,X2330F_II,0,
BACH2PUBLICUSE,,PVAGFRQ_1,1,8,1725,FOFD: J1yi. Would you say: pain vagina,X2406F_II,0,
BACH2PUBLICUSE,,PVAGHEP_1,1,8,1728,FOFD: J1yiv. Seen provider for this symptom: pain vagina,X2506F_II,0,
BACH2PUBLICUSE,,PVAGTRT_1,1,8,1729,FOFD: J1yv. IF YES: Did you receive treatment: pain vagina,X2465F_II,0,
BACH2PUBLICUSE,,PVD,1,8,854,FOID: E3v. Peripheral vascular disease,X2511F_II,0,
BACH2PUBLICUSE,,PVDAGE,1,8,107,FOID: E3vii. How old were you when you were first told,X2311F_II,0,
BACH2PUBLICUSE,,PVDAGE_1,1,8,374,FOFB: E1iii. Ever told you had: Peripheral Vascular Disease: Age,X2311F_II,0,
BACH2PUBLICUSE,,PVDTX,1,8,106,FOID: E3vi. Have you ever or are you currently receiving treatment,X2501F_II,0,
BACH2PUBLICUSE,,PVD_1,1,8,1217,FOFB: E1ii1. Ever told you had: Peripheral Vascular Disease,X2506F_II,0,
BACH2PUBLICUSE,,PVULCUR_1,1,8,500,FOFC: G12c. Last 12 months:Is this pain in the area of the bladder,X2506F_II,0,
BACH2PUBLICUSE,,PVULOPEN_1,1,8,514,FOFC: G12b. Pain at the opening of the vulva lasted for 3 months,X2506F_II,0,
BACH2PUBLICUSE,,PVULVALOC_1,1,8,495,FOFC: G12a. Where was the vulva pain located?,X2384F_II,0,
BACH2PUBLICUSE,,PVULVA_1,1,8,1722,FOFC: G12. Had pain at the vulva with intercourse or spontaneously,X2506F_II,0,
BACH2PUBLICUSE,,RACEOTRC,1,8,13,INS1: C5f. Race: Other,X2506F_II,0,
BACH2PUBLICUSE,,RAYNAGE,1,8,105,FOID: E3uii. How old were you when you were first told,X2311F_II,0,
BACH2PUBLICUSE,,RAYNAUDAGE_1,1,8,373,FOFB: E1hhi. Ever told you had: Raynauds Disease: Age,X2311F_II,0,
BACH2PUBLICUSE,,RAYNAUDS,1,8,853,FOID: E3u. Raynauds disease,X2511F_II,0,
BACH2PUBLICUSE,,RAYNAUDS_1,1,8,1216,FOFB: E1hh. Ever told you had: Raynauds Disease,X2506F_II,0,
BACH2PUBLICUSE,,RAYNTX,1,8,104,FOID: E3ui. Have you ever or are you currently receiving treatment,X2501F_II,0,
BACH2PUBLICUSE,,REGCARE,1,8,884,FOIE: E10a. Do you go for regular care,X2506F_II,0,
BACH2PUBLICUSE,,RESFLUID,1,8,1026,FOIG: K5a. Drinking fluids before you travel?,X2336F_II,0,
BACH2PUBLICUSE,,RESFLUID_1,1,8,1494,FOFD: J5a. Drinking fluids before you travel,X2444F_II,0,
BACH2PUBLICUSE,,RINGAGE,1,8,54,FOIC: D2ei. How old were you when you began using,X2311F_II,0,
BACH2PUBLICUSE,,RINGAGE_1,1,8,429,FOFC: F2ei. How old were you when you began using?,X2311F_II,0,
BACH2PUBLICUSE,,RINGDUR,1,8,55,FOIC: D2eii. For how long altogether have you used,X2311F_II,0,
BACH2PUBLICUSE,,RINGDUR_1,1,8,430,FOFC: F2eii. For how long altogether have you used,X2311F_II,0,
BACH2PUBLICUSE,,RINGNOW,1,8,1639,FOIC: D2e. Vaginal ring,X2499F_II,0,
BACH2PUBLICUSE,,RINGNOW_1,1,8,1698,FOFC: F2e. Ever used Vaginal Ring :If Yes: Is this Current?,X2503F_II,0,
BACH2PUBLICUSE,,RINGUNT,1,8,56,FOIC: D2eiii. Units,X2431F_II,0,
BACH2PUBLICUSE,,RINGUNT_1,1,8,431,FOFC: F2eiii. Units,X2431F_II,0,
BACH2PUBLICUSE,,ROSE1,1,8,197,FOIE: E13a. Have you ever had pain or discomfort in your chest,X2506F_II,0,
BACH2PUBLICUSE,,ROSE2,1,8,198,FOIE: E13b. Do you get this pain or discomfort when you walk uphill,X2506F_II,0,
BACH2PUBLICUSE,,ROSE3,1,8,199,FOIE: E13c. Do you get it when you walk at an ordinary pace,X2506F_II,0,
BACH2PUBLICUSE,,ROSE4,1,8,200,"FOIE: E13d. When you get any pain or discomfort, what do you do",X2468F_II,0,
BACH2PUBLICUSE,,ROSE5,1,8,201,FOIE: E13e. Does it go away if you stand still,X2506F_II,0,
BACH2PUBLICUSE,,ROSE6,1,8,202,FOIE: E13e1. How quickly does it go away,X2346F_II,0,
BACH2PUBLICUSE,,ROSE7,1,8,203,FOIE: E13f1. Sternum (upper or middle),X2506F_II,0,
BACH2PUBLICUSE,,ROSE8,1,8,204,FOIE: E13f2. Sternum (lower),X2506F_II,0,
BACH2PUBLICUSE,,ROSE9,1,8,205,FOIE: E13f3. Left anterior chest,X2506F_II,0,
BACH2PUBLICUSE,,ROSE10,1,8,206,FOIE: E13f4. Left arm,X2506F_II,0,
BACH2PUBLICUSE,,ROSE11,1,8,207,FOIE: E13f5. Other,X2506F_II,0,
BACH2PUBLICUSE,,ROSE12,1,8,208,FOIE: E14. Have you ever had severe pain across the front of your chest,X2506F_II,0,
BACH2PUBLICUSE,,ROSE13,1,8,209,FOIE: E15a. Do you get pain in either leg when walking,X2506F_II,0,
BACH2PUBLICUSE,,ROSE14,1,8,210,FOIE: E15b. Does this pain ever begin when you are standing still,X2506F_II,0,
BACH2PUBLICUSE,,ROSE15,1,8,211,FOIE: E15c. Do you get this pain in your calf,X2506F_II,0,
BACH2PUBLICUSE,,ROSE16,1,8,212,FOIE: E15d. Do you get it when you walk uphill,X2506F_II,0,
BACH2PUBLICUSE,,ROSE17,1,8,213,FOIE: E15e. Do you get it when you walk at an ordinary pace,X2506F_II,0,
BACH2PUBLICUSE,,ROSE18,1,8,214,FOIE: E15f. Does the pain ever disappear while you are still walking,X2506F_II,0,
BACH2PUBLICUSE,,ROSE19,1,8,215,FOIE: E15g. What do you do if you get it when you are walking,X2467F_II,0,
BACH2PUBLICUSE,,ROSE20,1,8,216,FOIE: E15h. What usually happens if you stand still,X2381F_II,0,
BACH2PUBLICUSE,,RT4LVDIS,1,8,1675,FOSW: PF13. How would you rate your level of discomfort,X2313F_II,0,
BACH2PUBLICUSE,,RT4SDSIN,1,8,1667,FOSW: PF2. How would you rate your level of sexual desire or interest,X2488F_II,0,
BACH2PUBLICUSE,,RTCNFERC,1,8,1084,FOSM: PM9. How do you rate your confidence that you can keep erection,X2490F_II,0,
BACH2PUBLICUSE,,RTCNFERC_1,1,8,1570,MSAQ: 11. Confidence in an erection,X2481F_II,0,
BACH2PUBLICUSE,,RVASAGE,1,8,219,"FOIF: G1b1i. If yes, how old were you?",X2311F_II,0,
BACH2PUBLICUSE,,RVASAGE_1,1,8,434,FOFC: G1b1i. How old were you at the time of surgery:Age,X2311F_II,0,
BACH2PUBLICUSE,,RVASECT,1,8,930,FOIF: G1b1. Reversal of a vasectomy,X2506F_II,0,
BACH2PUBLICUSE,,RVASECT_1,1,8,1274,FOFC: G1b1. Have you seen HealthCare Provider For: Reversal Vasectomy,X2506F_II,0,
BACH2PUBLICUSE,,S12080800,1,8,1992,T1: Anticholinergics - some overlap with spui,X2506F_II,0,
BACH2PUBLICUSE,,S92080000,1,8,1993,T1: 5-alpha reductase inhibitors,X2506F_II,0,
BACH2PUBLICUSE,,S12080800_1,1,8,1995,T2: Anticholinergics - some overlap with spui_1,X2506F_II,0,
BACH2PUBLICUSE,,S92080000_1,1,8,1996,T2: 5-alpha reductase inhibitors,X2506F_II,0,
BACH2PUBLICUSE,,SACRUM_M,1,8,664,PAIN: C60b. Sacrum: most pain,X2505F_II,0,
BACH2PUBLICUSE,,SACRUM_S,1,8,663,PAIN: C60a. Sacrum: shaded pain,X2505F_II,0,
BACH2PUBLICUSE,,SAID,1,8,31,FOIB: C2q. Any steroid anti-inflammatories,X2506F_II,0,
BACH2PUBLICUSE,,SAIDOTC,1,8,39,FOIC: C3f. Any steroidal anti-inflammatories,X2506F_II,0,
BACH2PUBLICUSE,,SAIDOTC_1,1,8,689,FOFA: D3e. Last four weeks: Steroidal Anti inflammatories,X2506F_II,0,
BACH2PUBLICUSE,,SAID_1,1,8,680,FOFA: D2p. Any steroid anti-inflammatories,X2506F_II,0,
BACH2PUBLICUSE,,SBP001,1,8,1102,FOSC: C4. 1st systolic blood pressure (imputed),X2311F_II,0,
BACH2PUBLICUSE,,SBP002,1,8,281,FOSC: C7. 2nd systolic blood pressure (not imputed),X2311F_II,0,
BACH2PUBLICUSE,,SCAGEC,1,8,5,INS1: C3. What is your age?,X2311F_II,0,
BACH2PUBLICUSE,,SCGENDEC,1,8,4,INS1: C2. Are you male or female?,X2428F_II,0,
BACH2PUBLICUSE,,SCHISPC,1,8,6,INS1: C4. Are you Hispanic or Latino (Latina)?,X2506F_II,0,
BACH2PUBLICUSE,,SCORIGINC,1,8,7,INS1: C4a. Hispanic/Latino: Are you?,X2430F_II,0,
BACH2PUBLICUSE,,SCRNMODE,1,8,3,INS1: A6. Survey mode,X2410F_II,0,
BACH2PUBLICUSE,,SELFADMIN,1,8,266,FOIJ: P2. Did the interviewer admininster the self-admin form:,X2506F_II,0,
BACH2PUBLICUSE,,SELFPAY,1,8,893,FOIE: E11e. Insurance you purchased entirely by yourself,X2506F_II,0,
BACH2PUBLICUSE,,SELFPAY_1,1,8,1244,FOFB: E6b. Health Insurance: Self Paid Insurance,X2506F_II,0,
BACH2PUBLICUSE,,SES_NE,1,8,1770,"Socioeconomic status, NE region",,0,
BACH2PUBLICUSE,,SES_NE_1,1,8,1772,"Socioeconomic status, NE region",,0,
BACH2PUBLICUSE,,SEXDYSAGE_1,1,8,393,FOFB: E1bbbi. Ever told you had: sexual dysfunction: Age,X2311F_II,0,
BACH2PUBLICUSE,,SEXDYS_1,1,8,1693,FOFB: E1bbb. Ever told you had: sexual dysfunction,X2506F_II,0,
BACH2PUBLICUSE,,SEXORNT,1,8,1092,FOSM: PM17. How would you define yourself,X2403F_II,0,
BACH2PUBLICUSE,,SEXORNT_1,1,8,1577,MSAQ/WSAQ: How would you define yourself?,X2403F_II,0,
BACH2PUBLICUSE,,SF01,1,8,813,"FOIA: B1. In general, would you say your health is",X2393F_II,0,
BACH2PUBLICUSE,,SF02,1,8,814,FOIA: B2a. Moderate activities,X2500F_II,0,
BACH2PUBLICUSE,,SF03,1,8,815,FOIA: B2b. Climbing several flights of stairs,X2500F_II,0,
BACH2PUBLICUSE,,SF04,1,8,816,FOIA: B3a. Accomplished less than you would like (physical),X2506F_II,0,
BACH2PUBLICUSE,,SF05,1,8,817,FOIA: B3b. Were limited in the kind of work or other activities,X2506F_II,0,
BACH2PUBLICUSE,,SF06,1,8,818,FOIA: B4a. Accomplished less than you would like (emotional),X2506F_II,0,
BACH2PUBLICUSE,,SF07,1,8,819,FOIA: B4b. Didn't do work or other activities as carefully as usual,X2506F_II,0,
BACH2PUBLICUSE,,SF08,1,8,820,FOIA: B5. How much did pain interfere with your normal work,X2450F_II,0,
BACH2PUBLICUSE,,SF09,1,8,821,FOIA: B6a. Have you felt calm and peaceful,X2443F_II,0,
BACH2PUBLICUSE,,SF10,1,8,822,FOIA: B6b. Did you have a lot of energy,X2443F_II,0,
BACH2PUBLICUSE,,SF11,1,8,823,FOIA: B6c. Have you felt downhearted and blue,X2443F_II,0,
BACH2PUBLICUSE,,SF12,1,8,824,FOIA: B7. How much have physical or emotional problems interfered,X2444F_II,0,
BACH2PUBLICUSE,,SF01_1,1,8,1131,"FOFA: B1. In general, would you say your health is",X2393F_II,0,
BACH2PUBLICUSE,,SF02_1,1,8,1132,FOFA: B2a. Moderate activities,X2500F_II,0,
BACH2PUBLICUSE,,SF03_1,1,8,1133,FOFA: B2b. Climbing several flights of stairs,X2500F_II,0,
BACH2PUBLICUSE,,SF04_1,1,8,1134,FOFA: B3a. Accomplished less than you would like (physical),X2359F_II,0,
BACH2PUBLICUSE,,SF05_1,1,8,1135,FOFA: B3b. Were limited in the kind of work or other activities,X2359F_II,0,
BACH2PUBLICUSE,,SF06_1,1,8,1136,FOFA: B4a. Accomplished less than you would like (emotional- ),X2359F_II,0,
BACH2PUBLICUSE,,SF07_1,1,8,1137,FOFA: B4b. Didn't do work or other activities as carefully as usual,X2359F_II,0,
BACH2PUBLICUSE,,SF08_1,1,8,1138,FOFA: B5. How much did pain interfere with your normal work,X2450F_II,0,
BACH2PUBLICUSE,,SF09_1,1,8,1139,FOFA: B6a. Have you felt calm and peaceful,X2358F_II,0,
BACH2PUBLICUSE,,SF10_1,1,8,1140,FOFA: B6b. Did you have a lot of energy,X2358F_II,0,
BACH2PUBLICUSE,,SF11_1,1,8,1141,FOFA: B6c. Have you felt downhearted and blue,X2358F_II,0,
BACH2PUBLICUSE,,SF12_1,1,8,1142,FOFA: B7. How much time physical health affected social activities,X2358F_II,0,
BACH2PUBLICUSE,,SITDUR,1,8,908,FOIE: F1ai. How many hours per day (participate in sitting),X2415F_II,0,
BACH2PUBLICUSE,,SITDUR_1,1,8,1144,FOFA: D1ai. Seven days: Sitting activities: Hours,X2415F_II,0,
BACH2PUBLICUSE,,SITTING,1,8,907,FOIE: F1a. How often did you (participate in sitting),X2317F_II,0,
BACH2PUBLICUSE,,SITTING_1,1,8,1143,FOFA: D1a. Seven days: Sitting activities,X2316F_II,0,
BACH2PUBLICUSE,,SKCARE1,1,8,899,FOIE: E12a. Pain or burning in your bladder,X2398F_II,0,
BACH2PUBLICUSE,,SKCARE2,1,8,900,FOIE: E12b. Needing to wear a pad,X2398F_II,0,
BACH2PUBLICUSE,,SKCARE3,1,8,901,FOIE: E12c. Chronic pain in your pelvic area,X2398F_II,0,
BACH2PUBLICUSE,,SKCARE4,1,8,902,FOIE: E12d. Noticing a decline in your interest in sex,X2398F_II,0,
BACH2PUBLICUSE,,SKCARE5,1,8,903,FOIE: E12e. Being told that a sibling had been diagnosed with diabetes,X2398F_II,0,
BACH2PUBLICUSE,,SKCARE6,1,8,904,FOIE: E12f. Finding you have to urinate frequently,X2398F_II,0,
BACH2PUBLICUSE,,SKCARE7,1,8,905,FOIE: E12g. Difficulty obtaining or maintaining an erection,X2398F_II,0,
